-- phpMyAdmin SQL Dump
-- version 5.2.0
-- https://www.phpmyadmin.net/
--
-- Host: 127.0.0.1
-- Generation Time: Sep 04, 2024 at 02:43 AM
-- Server version: 10.4.27-MariaDB
-- PHP Version: 7.4.33

SET SQL_MODE = "NO_AUTO_VALUE_ON_ZERO";
START TRANSACTION;
SET time_zone = "+00:00";


/*!40101 SET @OLD_CHARACTER_SET_CLIENT=@@CHARACTER_SET_CLIENT */;
/*!40101 SET @OLD_CHARACTER_SET_RESULTS=@@CHARACTER_SET_RESULTS */;
/*!40101 SET @OLD_COLLATION_CONNECTION=@@COLLATION_CONNECTION */;
/*!40101 SET NAMES utf8mb4 */;

--
-- Database: `db_jadwal_cbt`
--

-- --------------------------------------------------------

--
-- Table structure for table `meminjam`
--

CREATE TABLE `meminjam` (
  `kode_pinjam` int(15) NOT NULL,
  `id_ruang` int(15) NOT NULL,
  `nama_peminjam` varchar(255) NOT NULL,
  `instansi_peminjam` varchar(50) NOT NULL,
  `nama_ruang` varchar(50) NOT NULL,
  `nama_kegiatan` varchar(255) NOT NULL,
  `tgl_pinjam` varchar(50) NOT NULL,
  `start_date` varchar(50) NOT NULL,
  `end_date` varchar(50) NOT NULL,
  `jumlah_mahasiswa` varchar(100) NOT NULL,
  `status` varchar(15) NOT NULL,
  `keterangan` text NOT NULL,
  `color` varchar(25) NOT NULL
) ENGINE=InnoDB DEFAULT CHARSET=latin1 COLLATE=latin1_swedish_ci;

--
-- Dumping data for table `meminjam`
--

INSERT INTO `meminjam` (`kode_pinjam`, `id_ruang`, `nama_peminjam`, `instansi_peminjam`, `nama_ruang`, `nama_kegiatan`, `tgl_pinjam`, `start_date`, `end_date`, `jumlah_mahasiswa`, `status`, `keterangan`, `color`) VALUES
(1007, 101, 'lisa Ervina', 'Promosi Kesehatan', 'Lab Komputer', 'UTS', '', '2022-11-14 14:05', '2022-11-14 15:05', '', 'Selesai', '', '#0000FF'),
(1008, 102, 'Tetes Wahyu W, SST, M. Biomed', 'Jurusan Gizi', 'Ruang Teater', 'Perkuliahan MK Metodologi Penelitian Tk II Prodi D. IIII Gizi', '', '2023-01-23 08:00', '2023-01-23 14:40', '', 'Selesai', '', '#0000FF'),
(1009, 101, 'Tetes Wahyu W, SST, M. Biomed', 'Jurusan Gizi', 'Lab Komputer', 'Perkuliahan MK Aplikasi Komputer', '', '2023-01-18 08:00', '2023-01-18 11:20', '', 'Selesai', '', '#0000FF'),
(1010, 101, 'Tetes Wahyu W, SST, M. Biomed', 'Jurusan Gizi', 'Lab Komputer', 'Perkuliahan MK Aplikasi Komputer Prodi STr Tk II b', '', '2023-01-19 08:00', '2023-01-19 11:20', '100', 'Selesai', '', '#0000FF'),
(1011, 102, 'Dr. Meriwati, SKM, MKM', 'Jurusan Gizi', 'Ruang Teater', 'Perkuliahan MK Surveilance Gizi Prodi STr Gizi Tk III', '', '2023-01-17 08:00', '2023-01-17 16:20', '', 'Selesai', '', '#0000FF'),
(1012, 102, 'Dr. Meriwati, SKM, MKM', 'Jurusan Gizi', 'Ruang Teater', 'Perkuliahan MK PPG Prodi STr Tk III', '', '2023-01-19 08:00', '2023-01-19 16:20', '', 'Selesai', '', '#0000FF'),
(1013, 102, 'Dr. Betty Yosephin, SKM, MKM', 'Jurusan Gizi', 'Ruang Teater', 'Perkuliahan MK SPMI Tk II A Prodi D.III Gizi', '', '2023-01-18 08:00', '2023-01-18 12:30', '', 'Selesai', '', '#0000FF'),
(1014, 102, 'Tk III Gizi', 'Jurusan Gizi', 'Ruang Teater', 'Kuliah MK Kewirausahaan', '', '2023-01-20 08:00', '2023-01-20 11:30', '', 'Selesai', '', '#0000FF'),
(1016, 102, 'Yuke Firdahaliza ', 'Poltekkes Kemenkes Bengkulu ', 'Ruang Teater', 'Pembelajaran patofisiologi ', '', '2023-01-24 07:35', '2023-01-24 09:50', '100', 'Selesai', '', '#0000FF'),
(1017, 102, 'Dr. Meriwati, SKM, MKM', 'Jurusan Gizi Polkeslu', 'Ruang Teater', 'Perkuliahan MK SurveilansTk III Prodi STr Gizi', '', '2023-01-24 08:00', '2023-01-24 16:20', '', 'Batal', '', '#000'),
(1018, 101, 'Tetes Wahyu W, SST, M. Biomed', 'Jurusan Gizi', 'Lab Komputer', 'Perkuliahan Aplikasi Komputer Tk II A Prodi STr', '', '2023-01-25 08:00', '2023-01-25 11:20', '', 'Selesai', '', '#0000FF'),
(1019, 102, 'Dr. Meriwati, SKM, MKM', 'Jurusan Gizi', 'Ruang Teater', 'MK PPG Tk III Prodi STr', '', '2023-01-26 08:00', '2023-01-26 16:20', '', 'Selesai', '', '#0000FF'),
(1020, 101, 'Tetes Wahyu , SST, M. Biomed', 'Jurusan Gizi', 'Lab Komputer', 'MK Aplikom Tk II b Prodi STr', '', '2023-01-26 08:00', '2023-01-26 11:20', '', 'Selesai', '', '#0000FF'),
(1021, 101, 'Dr. Demsa Simbolon, SKM, MKM', 'Jurusan Gizi', 'Lab Komputer', 'MK Biostatistik Kasus Gizi Tk II a Prodi STr Gizi', '', '2023-01-26 13:30', '2023-01-26 16:50', '', 'Selesai', '', '#0000FF'),
(1022, 102, 'Tetes Wahyu W, SST, M. Biomed', 'Jurusan Gizi', 'Ruang Teater', 'Kuliah Tk II A', '', '2023-01-27 13:00', '2023-01-27 14:40', '', 'Selesai', '', '#0000FF'),
(1023, 101, 'Dr. Demsa Simbolon, SKM, MKM', 'Jurusan Gizi', 'Lab Komputer', 'MK Biostatistik Tk II B STr Gizi', '', '2023-01-27 13:30', '2023-01-27 16:50', '', 'Selesai', '', '#0000FF'),
(1024, 102, 'Bunda Rani', 'Jurusan Gizi', 'Ruang Teater', 'MK Kewirausahaan Tk III Prodi STr', '', '2023-01-27 09:00', '2023-01-27 15:50', '', 'Selesai', '', '#0000FF'),
(1025, 102, 'Promkes', 'Poltekkes Kemenkes Bengkulu', 'Ruang Teater', 'Pembekalan PKN LD', '', '2023-01-27 07:30', '2023-01-27 09:00', '', 'Selesai', '', '#0000FF'),
(1026, 102, 'Tetes Wahyu W, SST, M. Biomed', 'Jurusan Gizi', 'Ruang Teater', 'Kuliah MK Metodologi Penelitian Tk II B Prodi D. III Gizi', '', '2023-01-30 08:00', '2023-01-30 12:30', '', 'Selesai', '', '#0000FF'),
(1027, 102, 'Yuke Firdahaliza ', 'Poltekkes Kemenkes Bengkulu ', 'Ruang Teater', 'Pembelajaran ', '', '2023-01-31 08:00', '2023-01-31 10:00', '', 'Selesai', '', '#0000FF'),
(1028, 102, 'Yunita, SKM, M. Gizi', 'Jurusan Gizi', 'Ruang Teater', 'MK Surveilans Tk III Prodi STr Gizi', '', '2023-01-31 08:00', '2023-01-31 16:20', '', 'Batal', '', '#000'),
(1029, 102, 'Tetes Wahyu W, SST, M. Biomed', 'Jurusan Gizi', 'Ruang Teater', 'MK Metodologi Penelitian Tk II A Prodi D. III', '', '2023-01-30 13:00', '2023-01-30 14:50', '', 'Selesai', '', '#0000FF'),
(1030, 101, 'Jurusan Gizi', 'Jurusan Gizi', 'Lab Komputer', 'MK Etika Profesi Tk III B Prodi STr Gizi', '', '2023-01-31 08:00', '2023-01-31 10:30', '', 'Selesai', '', '#0000FF'),
(1031, 102, 'Yunita, SKM, M. Gizi', 'Jurusan Gizi', 'Ruang Teater', 'MK Surveilans Gizi Tk III STr ', '', '2023-01-31 11:00', '2023-01-31 13:00', '', 'Batal', '', '#000'),
(1033, 102, 'Aji Setya Guna Darma ', 'Sarjana Terapan Keperawatan tk 4', 'Ruang Teater', 'Pembekalan PKK KEP GADAR & Kritis', '', '2023-01-31 14:00', '2023-01-31 16:00', '', 'Selesai', '', '#0000FF'),
(1034, 102, 'Jumiyati, SKM, M. Gizi', 'Jurusan Gizi', 'Ruang Teater', 'Pembekalan PKL PIGM D.III Gizi', '', '2023-02-01 08:00', '2023-02-02 16:00', '', 'Selesai', '', '#0000FF'),
(1050, 101, 'Julita Cherly', 'Prodi D3 Kebidanan Poltekkes Kemenkes Bengkulu', 'Lab Komputer', 'UTS Semster IV MK PBAK', '', '2023-02-13 09:00', '2023-02-13 10:00', '52', 'Selesai', '', '#0000FF'),
(1051, 101, 'Julita Cherly', 'Prodi D3 Kebidanan Poltekkes Kemenkes Bengkulu', 'Lab Komputer', 'UTS Semester IV MK Askeb Neonatus Bayi dan Balita', '', '2023-02-14 08:30', '2023-02-14 10:00', '52', 'Selesai', '', '#0000FF'),
(1052, 101, 'Julita Cherly', 'Prodi D3 Kebidanan Poltekkes Kemenkes Bengkulu', 'Lab Komputer', 'UTS Semester IV MK Kesehatan Perempuan dan Perencanaan Keluarga', '', '2023-02-15 08:30', '2023-02-15 10:00', '52', 'Selesai', '', '#0000FF'),
(1053, 101, 'Julita Cherly', 'Prodi D3 Kebidanan Poltekkes Kemenkes Bengkulu', 'Lab Komputer', 'UTS Semester IV MK Kebdianan Komunitas', '', '2023-02-16 08:30', '2023-02-16 10:00', '52', 'Selesai', '', '#0000FF'),
(1054, 101, 'Dina Anggraini', 'D4 Kebidanan', 'Lab Komputer', 'UTS Metodelogi penelitian dan Biostatistik', '', '2023-02-08 08:00', '2023-02-08 12:30', '30 Orang', 'Selesai', '', '#0000FF'),
(1055, 101, 'Dina Anggraini', 'D4 Kebidanan ', 'Lab Komputer', 'UTS Epidemiologi', '', '2023-02-09 08:00', '2023-02-06 11:00', '30 Orang', 'Selesai', '', '#0000FF'),
(1056, 101, 'Dina Anggraini', 'D4 Kebidanan ', 'Lab Komputer', 'UTS Epidemiologi', '', '2023-02-09 08:00', '2023-02-06 11:00', '30 Orang', 'Selesai', '', '#0000FF'),
(1057, 101, 'Dina Anggraini', 'D4 Kebidanan', 'Lab Komputer', 'UTS Bahasa Inggris', '', '2023-02-10 08:00', '2023-02-10 11:00', '30 Orang', 'Selesai', '', '#0000FF'),
(1058, 102, 'Stevy dhea immanuel', 'Poltekkes Kemenkes Bengkulu ', 'Ruang Teater', 'Pembelajaran matkul patofisiologi ', '', '2023-02-07 10:00', '2023-02-07 11:40', '35 orang', 'Batal', '', '#000'),
(1059, 102, 'Tetes Wahyu W, SST, M. Biomed', 'Jurusan Gizi', 'Ruang Teater', 'MK Aplikasi Komputer Tk II A Prodi STr Gizi', '', '2023-02-08 08:00', '2023-02-08 11:20', '46', 'Selesai', '', '#0000FF'),
(1060, 102, 'Stevy Dhea Immanuel ', 'Polkesli', 'Ruang Teater', 'Pembelajaran patofisiologi ', '', '2023-02-07 10:00', '2023-02-07 11:40', '35', 'Batal', '', '#000'),
(1061, 102, 'Stevy Dhea Immanuel ', 'Polkesli', 'Ruang Teater', 'Pembelajaran patofisiologi ', '', '2023-02-07 10:00', '2023-02-07 11:40', '35', 'Selesai', '', '#0000FF'),
(1062, 102, 'Ramdhan Noer Ikhsan', 'Poltekkes Kemenkes Bengkulu', 'Ruang Teater', 'Perkuliahan Keperawatan GADAR', '', '2023-02-08 13:00', '2023-02-08 17:00', '86', 'Selesai', '', '#0000FF'),
(1063, 102, 'Dr. Tonny C Maigoda, SKM, MA', 'Jurusan Gizi', 'Ruang Teater', 'Kuliah MK PPG', '', '2023-02-09 13:00', '2023-02-09 16:20', '50', 'Selesai', '', '#0000FF'),
(1064, 101, 'Noviriyanti Arifin', 'Prodi Diploma Tiga Keperawatan', 'Lab Komputer', 'UTS Tk. 2 D3 Keperawatan', '', '2023-02-20 09:00', '2023-02-20 12:00', '98', 'Selesai', '', '#0000FF'),
(1065, 101, 'Noviriyanti Arifin', 'Prodi Diploma Tiga Keperawatan', 'Lab Komputer', 'UTS Tk.2 D3 Keperawatan', '', '2023-02-21 09:00', '2023-02-21 11:00', '98', 'Selesai', '', '#0000FF'),
(1066, 101, 'Noviriyanti Arifin', 'Prodi Diploma Tiga Keperawatan', 'Lab Komputer', 'UTS Tk. 2 D3 Keperawatan', '', '2023-02-22 09:00', '2023-02-22 11:00', '98', 'Selesai', '', '#0000FF'),
(1067, 101, 'Noviriyanti Arifin', 'Prodi Diploma Tiga Keperawatan', 'Lab Komputer', 'UTS Tk.2 D3 Keperawatan', '', '2023-02-23 09:00', '2023-02-23 11:00', '98', 'Selesai', '', '#0000FF'),
(1068, 101, 'Noviriyanti Arifin', 'Prodi Diploma Tiga Keperawatan', 'Lab Komputer', 'UTS Tk.2 Prodi D3 Keperawatan ', '', '2023-02-24 09:00', '2023-02-24 11:00', '98', 'Selesai', '', '#0000FF'),
(1069, 102, 'Mahasiswa Ners ', 'Prodi Pendidikan Profesi Ners Polkeslu', 'Ruang Teater', 'Seminar PPN Keperawatan Gadar dan Kritis', '', '2023-02-10 13:00', '2023-02-10 16:30', '40', 'Selesai', '', '#0000FF'),
(1070, 102, 'Nabilah Indriyana', 'Jurusan gizi', 'Ruang Teater', 'Perkuliahan kewirausahaan', '', '2023-02-11 08:00', '2023-02-10 11:30', '80', 'Selesai', '', '#0000FF'),
(1071, 101, 'Dina Anggraini', 'D-IV Kebidanan', 'Lab Komputer', 'UTS Bahasa', '', '2023-02-13 09:00', '2023-02-13 11:30', '30 Mahasiswa', 'Selesai', '', '#0000FF'),
(1072, 101, 'Atek chartika', 'Str keperawatan', 'Lab Komputer', 'Uts tk.3', '', '2023-02-20 07:57', '2023-02-24 16:57', '88', 'Selesai', '', '#0000FF'),
(1073, 102, 'Noviriyanti Arifin', 'D3 Keperawatan Bengkulu', 'Ruang Teater', 'Sosialisasi Peluang Kerja G to G ke Jepang', '', '2023-02-14 13:00', '2023-02-14 15:00', '86', 'Selesai', '', '#0000FF'),
(1074, 102, 'Noviriyanti Arifin', 'D3 Keperawatan Bengkulu', 'Ruang Teater', 'Sosialisasi Peluang Kerja G to G ke Jepang', '', '2023-02-14 13:00', '2023-02-14 15:00', '86', 'Selesai', '', '#0000FF'),
(1075, 102, 'Yuke Firdahaliza ', 'Str keperawatan Tk.1 Reguler ', 'Ruang Teater', 'Pembelajaran ', '', '2023-02-14 08:00', '2023-02-14 10:00', '63', 'Selesai', '', '#0000FF'),
(1076, 102, 'Ramdhan Noer Ikhsan', 'D3 Keperawatan Polkeslu', 'Ruang Teater', 'Perkuliahan Kep. Gadar', '', '2023-02-13 13:00', '2023-02-13 17:00', '86 Mahasiswa', 'Selesai', '', '#0000FF'),
(1077, 102, 'Stevy Dhea Immanuel ', 'RKI Str Keperawatan tk 1', 'Ruang Teater', 'Pembelajaran Patofisiologi ', '', '2023-02-14 10:00', '2023-02-14 11:40', '35', 'Selesai', '', '#0000FF'),
(1078, 102, 'Dr. Tonny C Maigoda, SKM, MA', 'Jurusan Gizi', 'Ruang Teater', 'MK Metlid Tk II B Prodi D.III Gizi', '', '2023-02-13 08:00', '2023-02-13 12:30', '46', 'Selesai', '', '#0000FF'),
(1079, 102, 'Dr. Tonny C Maigoda, SKM, MA', 'Jurusan Gizi', 'Ruang Teater', 'MK Metlid Tk II A Prodi D.III Gizi', '', '2023-02-13 13:00', '2023-02-13 14:50', '44', 'Selesai', '', '#0000FF'),
(1080, 102, 'Ramdhan Noer Ikhsan', 'D3 Keperawatan Bengkulu', 'Ruang Teater', 'Perkuliahan Kep. Gadar', '', '2023-02-14 13:00', '2023-02-14 16:00', '86 Mahasiswa', 'Selesai', '', '#0000FF'),
(1081, 102, 'Ramdhan Noer Ikhsan', 'D3 Keperawatan Bengkulu', 'Ruang Teater', 'Perkuliahan Kep. Gadar', '', '2023-02-14 08:00', '2023-02-14 12:00', '86 Mahasiswa', 'Batal', '', '#000'),
(1082, 102, 'Tetes Wahyu, SST, M. Biomed', 'Jurusan Gizi', 'Ruang Teater', 'Kuliah MK Aplikom Tk II A STr Gizi', '', '2023-02-15 08:00', '2023-02-15 11:20', '50', 'Selesai', '', '#0000FF'),
(1083, 102, 'Tetes Wahyu, SST, M. Biomed', 'Jurusan Gizi', 'Ruang Teater', 'Kuliah MK Aplikom Tk II B STr Gizi', '', '2023-02-16 08:00', '2023-02-16 11:20', '50', 'Selesai', '', '#0000FF'),
(1084, 102, 'Avrilya Iqoranny', 'Jurusan Gizi', 'Ruang Teater', 'Kuliah MK Kewirausahaan Tk III A STr Gizi', '', '2023-02-17 09:00', '2023-02-17 11:30', '50', 'Selesai', '', '#0000FF'),
(1085, 102, 'Ns. Erni Buston, SST., M.Kes', 'D3 Keperawatan Bengkulu', 'Ruang Teater', 'Perkuliahan Kep. Gadar', '', '2023-02-15 08:00', '2023-02-15 11:00', '86 Mahasiswa', 'Batal', '', '#000'),
(1086, 102, 'Dr. Tonny C Maigoda, SKM, MA', 'Jurusan Gizi', 'Ruang Teater', 'Kuliah MK PPG Tk III B Prodi STr Gizi', '', '2023-02-16 13:00', '2023-02-16 16:20', '40', 'Selesai', '', '#0000FF'),
(1088, 101, 'Dina Anggaini', 'D-IV Kebidanan', 'Lab Komputer', 'UTS Epidemiologi', '', '2023-02-17 10:00', '2023-02-17 11:10', '30 Orang', 'Selesai', '', '#0000FF'),
(1089, 102, 'Aldaffa Dwi Nugroho', 'Jurusan Gizi', 'Ruang Teater', 'Mata Kuliah Surveilans Gizi STR 3A', '', '2023-02-21 08:00', '2023-02-21 11:20', '40 Mahasiswa', 'Selesai', '', '#0000FF'),
(1090, 102, 'Ramdhan Noer Ikhsan', 'D3 Keperawatan Bengkulu', 'Ruang Teater', 'Pertemuan Mahasiswa PKL Jakarta', '', '2023-02-17 13:00', '2023-02-17 17:00', '86 mahasiswa', 'Selesai', '', '#0000FF'),
(1091, 102, 'Fharas Mutiara Hellindra ', 'Jurusan Analis Kesehatan Prodi D-III Farmasi ', 'Ruang Teater', 'Perkuliahan Bahasa Inggris', '', '2023-02-23 15:31', '2023-02-24 15:31', '97', 'Selesai', '', '#0000FF'),
(1092, 102, 'Fharas mutiara hellindra ', 'Jurusan Analis Kesehatan Prodi D-III Farmasi ', 'Ruang Teater', 'Perkuliahan bahasa inggris ', '', '2023-02-24 09:00', '2023-02-24 16:00', '97', 'Selesai', '', '#0000FF'),
(1093, 102, 'Rika Febrianti ', 'Str keperawatan ', 'Ruang Teater', 'Pembelajaran Patofisiologi ', '', '2023-02-21 08:00', '2023-02-21 10:00', '62', 'Selesai', '', '#0000FF'),
(1094, 102, 'Lina sundari', 'PRODI GIZI', 'Ruang Teater', 'kulia metlid', '', '2023-02-12 08:00', '2023-02-12 12:00', '46', 'Selesai', '', '#0000FF'),
(1095, 102, 'Lina sundari', 'D3 gizi 2B', 'Ruang Teater', 'Belajar metlid', '', '2023-02-20 08:30', '2023-02-20 12:30', '46', 'Selesai', '', '#0000FF'),
(1096, 102, 'Verly Prisilia', 'Jurusan Gizi', 'Ruang Teater', 'MK Aplikasi Komputer Tk TT A Prodi STr', '', '2023-02-22 08:00', '2023-02-22 11:20', '50', 'Selesai', '', '#0000FF'),
(1097, 102, 'Yuke Firdahaliza ', 'Str keperawatan Reguler TK.1', 'Ruang Teater', 'Pembelajaran ', '', '2023-02-28 08:00', '2023-02-28 10:00', '62 ', 'Selesai', '', '#0000FF'),
(1098, 102, 'Verly Prisilia', 'Jurusan Gizi', 'Ruang Teater', 'Kuliah MK Aplikasi Komputer Tk II B STr Gizi', '', '2023-02-23 08:00', '2023-02-23 11:20', '50', 'Selesai', '', '#0000FF'),
(1099, 102, 'Verly Prisilia', 'Jurusan Gizi', 'Ruang Teater', 'Kuliah MK Kewirausahaan Tk IIIa STr Gizi', '', '2023-02-24 09:00', '2023-02-24 11:30', '50', 'Batal', '', '#000'),
(1102, 101, 'Atek Chartika', 'Str kep', 'Lab Komputer', 'Uts tk.1', '', '2023-03-06 08:00', '2023-03-06 10:00', '90', 'Selesai', '', '#0000FF'),
(1103, 101, 'Atek chartika', 'Str keperawatan', 'Lab Komputer', 'Uts tk.1', '', '2023-03-07 08:00', '2023-03-07 10:00', '100', 'Selesai', '', '#0000FF'),
(1104, 101, 'Atek Chartika', 'Str keperawatan', 'Lab Komputer', 'Uts str tk.1', '', '2023-03-08 08:00', '2023-03-08 10:00', '100', 'Selesai', '', '#0000FF'),
(1105, 101, 'Atek chartika', 'Str keperawatan', 'Lab Komputer', 'Uts tk.1', '', '2023-03-09 08:00', '2023-03-09 10:00', '100', 'Selesai', '', '#0000FF'),
(1106, 101, 'Atek chartika', 'Str keperawatan', 'Lab Komputer', 'Uts tk.1', '', '2023-03-10 08:00', '2023-03-10 10:00', '100', 'Selesai', '', '#0000FF'),
(1115, 101, 'Atek chartika', 'Str keperawatan', 'Lab Komputer', 'Uts tk.2', '', '2023-03-13 08:00', '2023-03-13 10:00', '88', 'Selesai', '', '#0000FF'),
(1116, 101, 'Atek chartika', 'Str keperawatan', 'Lab Komputer', 'Uts tk.2', '', '2023-03-14 08:00', '2023-03-14 10:00', '88', 'Selesai', '', '#0000FF'),
(1117, 101, 'Atek chartika', 'Str keperawatan', 'Lab Komputer', 'Uts tk.2', '', '2023-03-15 08:00', '2023-03-15 10:00', '88', 'Selesai', '', '#0000FF'),
(1118, 101, 'Atek chartika', 'Str keperawatan', 'Lab Komputer', 'Uts tk.2', '', '2023-03-16 08:00', '2023-03-16 10:00', '88', 'Selesai', '', '#0000FF'),
(1119, 101, 'Atek chartika', 'Str keperawatan', 'Lab Komputer', 'Uts tk.2', '', '2023-03-17 08:00', '2023-03-17 10:00', '88', 'Selesai', '', '#0000FF'),
(1120, 101, 'Julita Cherly', 'D3 Kebidanan', 'Lab Komputer', 'UTS Kewarganegaraan', '', '2023-03-06 11:00', '2023-03-06 12:00', '58', 'Selesai', '', '#0000FF'),
(1121, 101, 'Julita Cherly', 'D3 Kebidanan', 'Lab Komputer', 'UTS Dokumentasi Kebidanan', '', '2023-03-07 10:00', '2023-03-07 11:00', '58', 'Selesai', '', '#0000FF'),
(1122, 101, 'Julita Cherly', 'D3 Kebidanan', 'Lab Komputer', 'UTS Gizi Dalam Kespro', '', '2023-03-07 11:00', '2023-03-07 12:00', '58', 'Selesai', '', '#0000FF'),
(1123, 101, 'Julita Cherly', 'D3 Kebidanan', 'Lab Komputer', 'UTS Farmakologi', '', '2023-03-08 10:00', '2023-03-08 11:00', '58', 'Selesai', '', '#0000FF'),
(1125, 101, 'Julita Cherly', 'D3 Kebidanan', 'Lab Komputer', 'UTS Pengantar Asuhan Kebidanan', '', '2023-03-10 10:00', '2023-03-10 13:00', '58', 'Selesai', '', '#0000FF'),
(1126, 101, 'Julita Cherly', 'D3 Kebidanan', 'Lab Komputer', 'UTS Keterampilan Klinik Praktik Kebidanan', '', '2023-03-09 10:00', '2023-03-09 12:00', '58', 'Selesai', '', '#0000FF'),
(1127, 102, 'Tiara dika marsela', 'GIZI/TK3B', 'Ruang Teater', 'perkuliahan', '', '2023-02-23 13:00', '2023-02-23 16:20', '40', 'Selesai', '', '#0000FF'),
(1128, 102, 'Farah diba', 'D4 keperawatan', 'Ruang Teater', 'Pkk seminar hasil kepdas', '', '2023-02-24 14:00', '2023-02-24 16:00', '16', 'Selesai', '', '#0000FF'),
(1129, 102, 'M.Bachtiar Sahari', 'Promkes', 'Ruang Teater', 'Latihan paduan suara', '', '2023-02-27 14:00', '2023-02-27 18:00', '35', 'Selesai', '', '#0000FF'),
(1130, 101, 'Lissa Ervina', 'Str Promosi Kesehatan', 'Lab Komputer', 'UTS TK I - Dasar-Dasar Komunikasi', '', '2023-03-06 09:00', '2023-03-06 10:00', '98', 'Selesai', '', '#0000FF'),
(1131, 101, 'Lissa Ervina', 'Str Promosi Kesehatan', 'Lab Komputer', 'UTS TK I - Dasar-Dasar Komunikasi', '', '2023-03-06 10:00', '2023-03-06 11:00', '98', 'Selesai', '', '#0000FF'),
(1132, 101, 'Lissa Ervina', 'Str Promosi Kesehatan', 'Lab Komputer', 'UTS TK II-PERENCANAAN PROGRAM PROMOSI KESEHATAN', '', '2023-03-06 13:00', '2023-03-06 14:00', '82', 'Selesai', '', '#0000FF'),
(1133, 101, 'Lissa Ervina', 'Str Promosi Kesehatan', 'Lab Komputer', 'UTS TK I - KEPEMIMPINAN', '', '2023-03-06 14:00', '2023-03-06 15:00', '98', 'Selesai', '', '#0000FF'),
(1134, 101, 'Lissa Ervina', 'Str Promosi Kesehatan', 'Lab Komputer', 'UTS TK II-PENGANTAR MEDIA PROMOSI KESEHATAN', '', '2023-03-06 15:00', '2023-03-06 16:00', '82', 'Selesai', '', '#0000FF'),
(1135, 101, 'Lissa Ervina', 'Str Promosi Kesehatan', 'Lab Komputer', 'UTS TK I - PENGANTAR DEMOGRAFI', '', '2023-03-07 13:00', '2023-03-07 14:00', '98', 'Batal', '', '#000'),
(1136, 101, 'Lissa Ervina', 'Str Promosi Kesehatan', 'Lab Komputer', 'UTS TK II-ILMU PENYAKIT MENULAR & TIDAK MENULAR', '', '2023-03-07 14:00', '2023-03-07 15:00', '82', 'Batal', '', '#000'),
(1137, 101, 'Lissa Ervina', 'Str Promosi Kesehatan', 'Lab Komputer', 'UTS TK I - PENGANTAR KESEHATAN MASYARAKAT', '', '2023-03-07 15:00', '2023-03-07 16:00', '98', 'Batal', '', '#000'),
(1138, 101, 'Lissa Ervina', 'Str Promosi Kesehatan', 'Lab Komputer', 'UTS TK I - EPIDEMIOLOGI', '', '2023-03-08 11:00', '2023-03-08 12:00', '98', 'Selesai', '', '#0000FF'),
(1139, 101, 'Lissa Ervina', 'Str Promosi Kesehatan', 'Lab Komputer', 'UTS TK II-SISTEM INFORMASI KESEHATAN', '', '2023-03-08 13:00', '2023-03-08 14:00', '82', 'Selesai', '', '#0000FF'),
(1140, 101, 'Lissa Ervina', 'Str Promosi Kesehatan', 'Lab Komputer', 'UTS TK I - PENGANTAR PSIKOLOGI', '', '2023-03-08 14:00', '2023-03-08 15:00', '98', 'Selesai', '', '#0000FF'),
(1141, 101, 'Lissa Ervina', 'Str Promosi Kesehatan', 'Lab Komputer', 'UTS TK II-KEMITRAAN DALAM PROMOSI KESEHATAN', '', '2023-03-08 15:00', '2023-03-08 16:00', '82', 'Selesai', '', '#0000FF'),
(1142, 101, 'Lissa Ervina', 'Str Promosi Kesehatan', 'Lab Komputer', 'UTS TK I - PENGANTAR PROMOSI KESEHATAN', '', '2023-03-09 13:00', '2023-03-09 14:00', '98', 'Batal', '', '#000'),
(1143, 101, 'Lissa Ervina', 'Str Promosi Kesehatan', 'Lab Komputer', 'UTS TK II-PERILAKU KESEHATAN', '', '2023-03-09 14:00', '2023-03-09 15:00', '82', 'Batal', '', '#000'),
(1144, 101, 'Lissa Ervina', 'Str Promosi Kesehatan', 'Lab Komputer', 'UTS TK I - JAMINAN KESEHATAN NASIONAL', '', '2023-03-10 13:00', '2023-03-10 14:00', '98', 'Selesai', '', '#0000FF'),
(1145, 101, 'Lissa Ervina', 'Str Promosi Kesehatan', 'Lab Komputer', 'UTS TK II-MANAJEMEN PENYAKIT BERBASIS WILAYAH', '', '2023-03-10 14:00', '2023-03-10 15:00', '82', 'Selesai', '', '#0000FF'),
(1146, 101, 'Siventri', 'Jurusan Gizi', 'Lab Komputer', 'UTS MK Dietetik Tk II', '', '2023-03-13 10:00', '2023-03-13 12:00', '80', 'Selesai', '', '#0000FF'),
(1147, 101, 'Siventri', 'Jurusan Gizi', 'Lab Komputer', 'UTS MK GDDK Tk I', '', '2023-03-13 13:00', '2023-03-13 15:00', '90', 'Batal', '', '#000'),
(1148, 101, 'Siventri', 'Jurusan Gizi', 'Lab Komputer', 'UTS MK SKP Tk II', '', '2023-03-14 10:00', '2023-03-14 12:00', '80', 'Selesai', '', '#0000FF'),
(1149, 101, 'Siventri', 'Jurusan Gizi', 'Lab Komputer', 'UTS MK IKM Tk I', '', '2023-03-14 13:00', '2023-03-14 15:00', '90', 'Batal', '', '#000'),
(1150, 101, 'Siventri', 'Jurusan Gizi', 'Lab Komputer', 'UTS MK Metodologi Penelitian Tk II', '', '2023-03-15 10:00', '2023-03-15 12:00', '80', 'Selesai', '', '#0000FF'),
(1151, 101, 'Afrizal, S. Gz', 'Jurusan Gizi', 'Lab Komputer', 'UTS MK SKP ', '', '2023-03-06 12:00', '2023-03-06 13:00', '91', 'Selesai', '', '#0000FF'),
(1152, 101, 'Afrizal', 'Jurusan Gizi', 'Lab Komputer', 'UTS MK SPMI', '', '2023-03-08 12:00', '2023-03-08 13:00', '91', 'Selesai', '', '#0000FF'),
(1153, 101, 'Afrizal', 'Jurusan Gizi', 'Lab Komputer', 'UTS MK Dietetik', '', '2023-03-09 12:00', '2023-03-09 13:00', '91', 'Selesai', '', '#0000FF'),
(1154, 101, 'Dina Anggraini', 'D-IV Kebidanan', 'Lab Komputer', 'UTS Mata Kuliah Pancasila Tk I', '', '2023-03-06 08:00', '2023-03-06 08:50', '98', 'Batal', '', '#000'),
(1155, 101, 'Dina Anggraini', 'D-IV Kebidanan', 'Lab Komputer', 'UTS MK Bahasa Indonesia TK I', '', '2023-03-06 08:50', '2023-03-06 09:35', '98 Mahasiswa', 'Batal', '', '#000'),
(1156, 101, 'Dina Anggraini', 'D-IV Kebidanan', 'Lab Komputer', 'UTS MK EBM dan MK KDPK TK II', '', '2023-03-06 09:40', '2023-03-06 12:20', '70 mahasiswa', 'Batal', '', '#000'),
(1157, 101, 'Dina Anggraini', 'D-IV Kebidanan', 'Lab Komputer', 'UTS  MK Asuhan Kebidanan Pada Kasus Komplek TK III', '', '2023-03-06 13:00', '2023-03-06 13:45', '47 Mahasiswa', 'Batal', '', '#000'),
(1158, 101, 'Dina Anggraini', 'D-IV Kebidanan', 'Lab Komputer', 'UTS  MK Psikologi dalam Pratik Keb dan Fatofisologi', '', '2023-03-06 13:45', '2023-03-06 15:20', '29 Mahasiswa', 'Batal', '', '#000'),
(1159, 101, 'Dina Anggraini', 'D-IV Kebidanan', 'Lab Komputer', 'UTS MK Fisika Kesehatan dan Biokimia dan  FARMAKOLOGI TK I, ', '', '2023-03-07 08:00', '2023-03-07 09:35', '98 mahasiswi', 'Batal', '', '#000'),
(1160, 101, 'Dina Anggraini', 'D-IV Kebidanan', 'Lab Komputer', 'UTS Askeb  Remaja dan Askeb Pranikah TK II', '', '2023-03-07 15:00', '2023-03-07 16:00', '70 ', 'Selesai', '', '#0000FF'),
(1161, 101, 'Dina Anggraini', 'D-IV Kebidanan', 'Lab Komputer', 'UTS Biorep dan UTS Fisika Kesehatan ', '', '2023-03-07 14:00', '2023-03-07 15:00', '47', 'Selesai', '', '#0000FF'),
(1162, 101, 'Dina Anggraini', 'D-IV Kebidanan', 'Lab Komputer', 'UTS  MK Praktik Profesional Bidan dan MK Manajemen  TK III', '', '2023-03-07 13:00', '2023-03-07 14:00', '47 Mahasiswa', 'Selesai', '', '#0000FF'),
(1163, 101, 'Dina Anggraini', 'D-IV Kebidanan', 'Lab Komputer', 'UTS MK  Fisiologi Kehamilan dan MK Psikologi TK I', '', '2023-03-08 08:00', '2023-03-07 10:15', '98 Mahasiswa', 'Batal', '', '#000'),
(1164, 101, 'Dina Anggraini', 'D-IV Kebidanan', 'Lab Komputer', 'UTS  MK Fisiologi Kehamilan dan MK Psikologi TK I', '', '2023-03-08 08:00', '2023-03-08 10:15', '98 Mahasiswa', 'Batal', '', '#000'),
(1165, 101, 'Dina Anggraini', 'D-IV Kebidanan', 'Lab Komputer', 'UTS MK KB dan MK IKK TK II', '', '2023-03-08 10:20', '2023-03-08 12:15', '70 Mahasiswa', 'Batal', '', '#000'),
(1166, 101, 'Dina Anggraini', 'D-IV Kebidanan ', 'Lab Komputer', 'UTS MK Fetomaternal dan MK Pemberdayaan Masyarakat TK III', '', '2023-03-08 13:00', '2023-03-08 14:35', '47 Mahasiswa', 'Batal', '', '#000'),
(1167, 101, 'Dina Anggraini', 'D-IV Kebidanan', 'Lab Komputer', 'UTS MK IKK Alih Jenjang', '', '2023-03-08 14:40', '2023-03-08 15:25', '29 Mahasiswa', 'Batal', '', '#000'),
(1168, 101, 'Dina Anggraini', 'D-IV Kebidanan', 'Lab Komputer', 'UTS MK Gizi Reproduksi dan MK Sosioantropologi TK I', '', '2023-03-09 15:00', '2023-03-09 16:00', '98 Orang', 'Selesai', '', '#0000FF'),
(1170, 101, 'Dina Anggraini', 'D-IV Kebidanan', 'Lab Komputer', 'UTS  MK Patient Safety dan MK Pelayanan Kebidanan Komunitas TK III', '', '2023-03-09 14:00', '2023-03-09 15:00', '47 Mahasiswa', 'Selesai', '', '#0000FF'),
(1171, 101, 'Dina Anggraini', 'D-IV Kebidanan', 'Lab Komputer', 'UTS Mk Critical Analysis  dan MK EBM  TK alih Jenjang', '', '2023-03-09 13:00', '2023-03-09 14:00', '29 Mahasiswa', 'Selesai', '', '#0000FF'),
(1172, 101, 'Dina Anggraini', 'D-IV Kebidanan', 'Lab Komputer', 'UTS MK Askeb pada anak dengan kondisi Rentan  TK III', '', '2023-03-10 09:00', '2023-03-10 09:45', '47  Mahasiswa', 'Batal', '', '#000'),
(1173, 101, 'Dina Anggraini', 'D-IV Kebidanan', 'Lab Komputer', 'UTS MK Manajemen Pelayanan Keb Profesional dan MK Mikrobiologi , Parastologi   alih Jenjang', '', '2023-03-10 09:50', '2023-03-10 11:25', '29 Mahasiswa', 'Batal', '', '#000'),
(1175, 101, 'LUPUS TRIP.', 'KESLING', 'Lab Komputer', 'UTS ', '', '2023-03-13 13:00', '2023-03-13 16:00', '82', 'Selesai', '', '#0000FF'),
(1176, 101, 'LUPUS TRIP.', 'KESLING', 'Lab Komputer', 'UTS', '', '2023-03-14 13:00', '2023-03-14 16:00', '82', 'Selesai', '', '#0000FF'),
(1177, 101, 'LUPUS TRIP.', 'KESLING', 'Lab Komputer', 'UTS', '', '2023-03-15 13:00', '2023-03-15 16:00', '82', 'Selesai', '', '#0000FF'),
(1178, 101, 'LUPUS TRIP.', 'KESLING', 'Lab Komputer', 'UTS', '', '2023-03-16 13:00', '2023-03-16 16:00', '82', 'Selesai', '', '#0000FF'),
(1180, 101, 'Atek chartika', 'Str keperawatan', 'Lab Komputer', 'Her uts manjemen bencana dan kep komunitas', '', '2023-02-28 13:00', '2023-02-28 14:10', '48', 'Selesai', '', '#0000FF'),
(1182, 102, 'Stevy Dhea Immanuel ', 'Str TK 1 keperawatan RKI', 'Ruang Teater', 'Pembelajaran patofisiologi ', '', '2023-02-28 10:00', '2023-02-28 11:40', '35 ', 'Selesai', '', '#0000FF'),
(1185, 102, 'HMJ Promkes', 'Promkes', 'Ruang Teater', 'Sidang Musyawarah Besar(Mubes) ', '', '2023-03-03 16:00', '2023-03-03 18:00', '50', 'Selesai', '', '#0000FF'),
(1186, 102, 'HMJ Promkes ', 'Promkes', 'Ruang Teater', 'Musyawarah besar (mubes) ', '', '2023-03-04 07:00', '2023-03-04 16:00', '50', 'Selesai', '', '#0000FF'),
(1187, 102, 'Nitha Carolina Dan Yendea Dwi Agsustin', 'Sarjana Terapan Gizi dan Dietetika', 'Ruang Teater', 'Kuliah Pakar', '', '2023-03-01 07:00', '2023-03-01 13:00', '91', 'Selesai', '', '#0000FF'),
(1188, 101, 'Atek Chartika', 'Str keperawatan', 'Lab Komputer', 'Her uts tk.3', '', '2023-03-01 09:30', '2023-03-01 10:10', '48', 'Selesai', '', '#0000FF'),
(1189, 101, 'Atek Chartika', 'Str keperawatan', 'Lab Komputer', 'Her uts tk.3', '', '2023-03-01 09:30', '2023-03-01 10:10', '48', 'Selesai', '', '#0000FF'),
(1190, 102, 'Lissa Ervina', 'Str Promosi Kesehatan', 'Ruang Teater', 'UTS TK I - PENGANTAR DEMOGRAFI', '', '2023-03-07 09:00', '2023-03-07 10:00', '98', 'Selesai', '', '#0000FF'),
(1191, 102, 'Lissa Ervina', 'Str Promosi Kesehatan', 'Ruang Teater', 'UTS TK II-ILMU PENYAKIT MENULAR & TIDAK MENULAR', '', '2023-03-07 10:00', '2023-03-07 11:00', '82', 'Selesai', '', '#0000FF'),
(1192, 102, 'Lissa Ervina', 'Str Promosi Kesehatan', 'Ruang Teater', 'UTS TK I - PENGANTAR KESEHATAN MASYARAKAT', '', '2023-03-07 11:00', '2023-03-07 12:00', '98', 'Selesai', '', '#0000FF'),
(1193, 102, 'Lissa Ervina', 'Str Promosi Kesehatan', 'Ruang Teater', 'UTS TK I - PENGANTAR PROMOSI KESEHATAN', '', '2023-03-09 08:00', '2023-03-09 10:00', '98', 'Selesai', '', '#0000FF'),
(1194, 102, 'Lissa Ervina', 'Str Promosi Kesehatan', 'Ruang Teater', 'UTS TK II-PERILAKU KESEHATAN', '', '2023-03-09 10:00', '2023-03-09 12:00', '82', 'Selesai', '', '#0000FF'),
(1195, 101, 'STr Tingkat 3', 'Poltekes Kemenkes Bengkulu', 'Lab Komputer', 'HER KEPERAWATAN JIWA', '', '2023-03-02 10:30', '2023-03-02 11:59', '47', 'Selesai', '', '#0000FF'),
(1196, 101, 'Atek chartika', 'Str keperawatan', 'Lab Komputer', 'Her keperawatan komunitas', '', '2023-03-03 11:00', '2023-03-03 11:55', '47', 'Selesai', '', '#0000FF'),
(1197, 101, 'Noviriyanti Arifin ', 'Prodi D3 Keperawatan', 'Lab Komputer', 'UTS Mahasiswa Tk. I', '', '2023-03-20 09:00', '2023-03-20 12:00', '52', 'Selesai', '', '#0000FF'),
(1198, 101, 'Noviriyanti Arifin ', 'Prodi D3 Keperawatan', 'Lab Komputer', 'UTS Mahasiswa Tk.I', '', '2023-03-21 09:00', '2023-03-21 12:00', '52', 'Selesai', '', '#0000FF'),
(1199, 101, 'Noviriyanti Arifin ', 'Prodi D3 Keperawatan', 'Lab Komputer', 'UTS Mahasiswa Tk.I', '', '2023-03-23 09:00', '2023-03-23 12:00', '52', 'Selesai', '', '#0000FF'),
(1200, 101, 'Noviriyanti Arifin ', 'Prodi D3 Keperawatan', 'Lab Komputer', 'UTS Mahasiswa Tk.I', '', '2023-03-24 09:00', '2023-03-24 15:00', '52 ', 'Selesai', '', '#0000FF'),
(1201, 101, 'Noviriyanti Arifin', 'Prodi D3 Keperawatan ', 'Lab Komputer', 'UTS Mahasiswa Tk.I', '', '2023-03-22 09:00', '2023-03-22 12:00', '52', 'Selesai', '', '#0000FF'),
(1203, 102, 'Ledyah citrah', 'Poltekkes kemenkes bengkulu', 'Ruang Teater', 'Seminar sistem perkemihan', '', '2023-03-10 12:30', '2023-03-10 16:00', '47', 'Selesai', '', '#0000FF'),
(1204, 101, 'Lissa Ervina', 'Str Promosi Kesehatan', 'Lab Komputer', 'UTS TK 3 Promkes', '', '2023-03-20 13:00', '2023-03-20 16:00', '70', 'Selesai', '', '#0000FF'),
(1205, 101, 'Lissa Ervina', 'Str Promosi Kesehatan', 'Lab Komputer', 'UTS TK 3 Promkes', '', '2023-03-21 13:00', '2023-03-21 16:00', '71', 'Selesai', '', '#0000FF'),
(1206, 101, 'Lissa Ervina', 'Str Promosi Kesehatan', 'Lab Komputer', 'UTS TK 3 Promkes', '', '2023-03-22 13:00', '2023-03-22 16:00', '70', 'Selesai', '', '#0000FF'),
(1207, 101, 'Lissa Ervina', 'Str Promosi Kesehatan', 'Lab Komputer', 'UTS TK 3 Promkes', '', '2023-03-23 13:00', '2023-03-23 16:00', '70', 'Selesai', '', '#0000FF'),
(1209, 102, 'Ns. Rahma Annisa, S. Kep., M. Kep', 'POLTEKKES KEMENKES BENGKULU', 'Ruang Teater', 'BTCLS ', '', '2023-03-15 07:00', '2023-03-15 17:00', '41', 'Selesai', '', '#0000FF'),
(1210, 102, 'Atek chartika', 'STR KEPERAWATAN', 'Ruang Teater', 'BTCLS', '', '2023-03-16 07:00', '2023-03-16 17:00', '42', 'Selesai', '', '#0000FF'),
(1211, 102, 'Atek chartika', 'Str Keperawatan', 'Ruang Teater', 'BTCLS', '', '2023-03-17 07:00', '2023-03-17 17:00', '42', 'Selesai', '', '#0000FF'),
(1212, 102, 'Atek Chartika', 'STR keperawatan', 'Ruang Teater', 'BTCLS', '', '2023-03-18 07:00', '2023-03-18 16:00', '42', 'Selesai', '', '#0000FF'),
(1213, 104, 'Atek Chartika', 'STR KEPERAWATAN', 'Lab Osca', 'BTCLS', '', '2023-03-16 07:00', '2023-03-16 17:00', '42', 'Selesai', '', '#0000FF'),
(1214, 104, 'ATEK CHARTIKA', 'STR KEPERAWATAN', 'Lab Osca', 'BTCLS', '', '2023-03-17 17:00', '2023-03-17 17:00', '42', 'Selesai', '', '#0000FF'),
(1215, 104, 'Atek Chartika', 'STR KEPERAWATAN', 'Lab Osca', 'BTCLS', '', '2023-03-18 07:00', '2023-03-18 17:00', '42', 'Selesai', '', '#0000FF'),
(1216, 102, 'M. Anugrah Supryadi', 'Gita Swara Medika polkeslu', 'Ruang Teater', 'Latihan Padus Wisuda ', '', '2023-03-13 16:49', '2023-03-19 16:49', '28', 'Selesai', '', '#0000FF'),
(1217, 102, 'Aldaffa Dwi Nugroho', 'Jurusan Gizi', 'Ruang Teater', 'MK Surveilans Gizi STR 3A', '', '2023-03-14 08:00', '2023-03-14 11:40', '40', 'Selesai', '', '#0000FF'),
(1218, 102, 'Hety Rais', 'Jurusan Gizi', 'Ruang Teater', 'Kuliah MK IOM Tk III B STr', '', '2023-03-13 10:00', '2023-03-13 12:00', '40', 'Selesai', '', '#0000FF'),
(1219, 102, 'Demsa Simbolon', 'Jurusan Gizi', 'Ruang Teater', 'MK Aplikom Tk IIA STr ', '', '2023-03-15 08:00', '2023-03-15 11:20', '46', 'Batal', 'Batal karena sudah di pinjam sama keperawatan lebih dulu', '#000'),
(1220, 102, 'Dr. Demsa Simbolon, SKM, MKM', 'Jurusan Gizi', 'Ruang Teater', 'Kuliah MK Aplikom Tk II B STr', '', '2023-03-16 08:00', '2023-03-16 11:20', '50', 'Batal', 'Batal Karena sudah di pinjam sama keperawatan lebih dulu', '#000'),
(1222, 101, 'Dina Anggraini', 'd4 kebidanan', 'Lab Komputer', 'uts biostatistik', '', '2023-03-17 10:00', '2023-03-17 11:00', '30', 'Selesai', '', '#0000FF'),
(1223, 102, 'Jurusan Gizi', 'Jurusan Gizi', 'Ruang Teater', 'Kuliah MK Surveilans Gizi Tk IIIa STr', '17-03-2023 16:36', '2023-03-21 08:00', '2023-03-21 11:20', '50', 'Selesai', '', '#0000FF'),
(1224, 102, 'Jurusan Gizi', 'Jurusan Gizi', 'Ruang Teater', 'Kuliah MK Kewirausahaan Tk IIIa STr', '17-03-2023 16:37', '2023-03-24 09:00', '2023-03-24 11:30', '50', 'Selesai', '', '#0000FF'),
(1225, 102, 'Lissa Ervina', 'STr Promkes', 'Ruang Teater', 'UTS Tingkat 3', '20-03-2023 00:23', '2023-03-24 13:00', '2023-03-24 16:00', '70', 'Selesai', '', '#0000FF'),
(1226, 101, 'Lissa Ervina', 'Str Promkes', 'Lab Komputer', 'UTS tk II', '20-03-2023 00:30', '2023-03-21 08:00', '2023-03-21 09:00', '82', 'Selesai', '', '#0000FF'),
(1227, 101, 'Lissa Ervina', 'Str Promkes', 'Lab Komputer', 'Ujian Tk II', '20-03-2023 00:31', '2023-03-24 15:00', '2023-03-24 16:00', '82', 'Selesai', '', '#0000FF'),
(1228, 101, 'Dina Anggraini', 'D4 Kebidanan', 'Lab Komputer', 'Her UTS', '20-03-2023 08:07', '2023-03-20 13:00', '2023-03-20 16:00', '30', 'Selesai', '', '#0000FF'),
(1229, 101, 'Dina Anggraini', 'D4 Kebidanan', 'Lab Komputer', 'Her UTS', '20-03-2023 14:31', '2023-03-21 08:00', '2023-03-21 12:00', '30', 'Selesai', '', '#0000FF'),
(1230, 101, 'Dina Anggraini', 'D4 Kebidanan', 'Lab Komputer', 'UAS Metode Penelitian dan Biostatistik', '20-03-2023 14:34', '2023-03-27 08:30', '2023-03-27 11:00', '30', 'Selesai', '', '#0000FF'),
(1232, 101, 'Dina Anggraini', 'D4 Kebidanan ', 'Lab Komputer', 'UAS Bahasa Inggris', '20-03-2023 14:39', '2023-03-29 08:30', '2023-03-29 10:00', '30', 'Selesai', '', '#0000FF'),
(1233, 101, 'Dina Anggraini', 'D4 Kebidanan', 'Lab Komputer', 'UAS Epidemiologi', '20-03-2023 14:48', '2023-03-28 08:30', '2023-03-28 10:00', '30', 'Selesai', '', '#0000FF'),
(1234, 102, 'Pak Tetes Wahyu,SST.M.BIOMED', 'Jurusan sarjana terapan gizi dan dietetika tingkat', 'Ruang Teater', 'Mata kuliah dietetika', '20-03-2023 15:36', '2023-03-21 08:00', '2023-03-21 12:00', '90', 'Batal', 'Pak tetes tidak bisa hadir, di ganti lain hari', '#000'),
(1235, 101, 'Lissa Ervina', 'Str Promosi Kesehatan', 'Lab Komputer', 'UTS Promkes', '24-03-2023 10:12', '2023-03-27 11:00', '2023-03-27 14:00', '83', 'Selesai', '', '#0000FF'),
(1236, 101, 'Atek Chartika', 'Str Keperawatan', 'Lab Komputer', 'UTS tk.3', '24-03-2023 10:10', '2023-04-03 08:30', '2023-04-03 10:30', '48', 'Selesai', '', '#0000FF'),
(1237, 101, 'Lissa Ervina', 'Str Promkes', 'Lab Komputer', 'UTS Promosi Kesehatan', '24-03-2023 10:15', '2023-03-28 10:00', '2023-03-28 12:00', '82', 'Selesai', '', '#0000FF'),
(1238, 101, 'Atek Chartika', 'STR KEPERAWATAN', 'Lab Komputer', 'Uts Tk.4 Kewirausahaan', '24-03-2023 10:16', '2023-04-03 10:30', '2023-04-03 12:00', '42', 'Selesai', '', '#0000FF'),
(1239, 101, 'Atek Chartika', 'Str Keperawatan', 'Lab Komputer', 'Uts tk.3 ', '24-03-2023 10:17', '2023-04-04 08:00', '2023-04-04 10:00', '48', 'Selesai', '', '#0000FF'),
(1240, 101, 'Lissa Ervina', 'Str Promosi Kesehatan', 'Lab Komputer', 'UTS Promkes', '24-03-2023 10:17', '2023-03-29 10:00', '2023-03-29 12:00', '82', 'Selesai', '', '#0000FF'),
(1241, 101, 'Atek Chartika', 'Str Keperawatan', 'Lab Komputer', 'Uts tk.4 Bahasa Jepang', '24-03-2023 10:18', '2023-04-04 10:00', '2023-04-04 11:30', '42', 'Selesai', '', '#0000FF'),
(1242, 101, 'Atek Chartika', 'STR keperawatan', 'Lab Komputer', 'UAS TK.3', '24-03-2023 10:19', '2023-04-05 08:00', '2023-04-05 10:00', '48', 'Selesai', '', '#0000FF'),
(1243, 101, 'Atek Chartika', 'STR keperawatan', 'Lab Komputer', 'UAS TK.3', '24-03-2023 10:20', '2023-04-06 08:00', '2023-04-06 10:00', '48', 'Selesai', '', '#0000FF'),
(1244, 101, 'Atek chartika', 'STR keperawatan', 'Lab Komputer', 'UAS TK.3', '24-03-2023 10:21', '2023-04-07 09:00', '2023-04-07 12:00', '48', 'Selesai', '', '#0000FF'),
(1245, 104, 'Farah diba', 'Str keperawatan tk.2', 'Lab Osca', 'Tutorial praktek ibu post partum', '26-03-2023 20:58', '2023-03-27 09:00', '2023-03-27 12:00', '46', 'Selesai', '', '#0000FF'),
(1246, 102, 'Audi Nurul Salsabila ', 'Poltekkes Kemenkes Bengkulu ', 'Ruang Teater', 'MK sosantro', '27-03-2023 08:05', '2023-03-27 08:06', '2023-03-27 09:40', '90', 'Selesai', '', '#0000FF'),
(1247, 101, 'Dina Anggraini', 'D4 Kebidanan', 'Lab Komputer', 'UAS Pancasila dan Bahasa Indonesia', '27-03-2023 11:18', '2023-05-15 08:00', '2023-05-15 10:00', '98', 'Batal', 'Ujian SIMAMA Gelombang 2', '#000'),
(1248, 101, 'Dina Anggraini', 'D4 Kebidanan', 'Lab Komputer', 'UAS Fisika Kesehatan, Biologi, dan Farmakologi', '27-03-2023 11:22', '2023-05-16 08:00', '2023-05-16 09:35', '98', 'Selesai', '', '#0000FF'),
(1249, 101, 'Dina Anggraini', 'D4 Kebidanan ', 'Lab Komputer', 'UAS Fisiologi Kehamilan dan Fsikologi', '27-03-2023 11:29', '2023-05-17 08:00', '2023-05-17 10:00', '98', 'Selesai', '', '#0000FF'),
(1250, 101, 'Dina Anggraini', 'D4 Kebidanan', 'Lab Komputer', 'UAS Gizi Repoduksi dan Sosio Antropologi', '27-03-2023 11:32', '2023-05-19 08:00', '2023-05-19 10:00', '98', 'Selesai', '', '#0000FF'),
(1251, 101, 'Dina Anggraini', 'D4 Kebidanan', 'Lab Komputer', 'UAS EBM dan KDPK II', '27-03-2023 11:35', '2023-05-15 10:00', '2023-05-15 12:00', '70', 'Batal', 'Ujian SIMAMA Gelombang 2', '#000'),
(1252, 101, 'Dina Anggraini', 'D4 Kebidanan', 'Lab Komputer', 'UAS Askeb Remaja, Perimenopause dan askeb Pranikah dan Prakonsepsi', '27-03-2023 11:38', '2023-05-16 10:00', '2023-05-16 12:00', '70', 'Selesai', '', '#0000FF'),
(1253, 101, 'Dina Anggraini ', 'D4 Kebidanan', 'Lab Komputer', 'UAS KB dan IKK', '27-03-2023 11:40', '2023-05-17 10:20', '2023-05-17 12:15', '70', 'Selesai', '', '#0000FF'),
(1254, 101, 'Dina Anggraini', 'D4 Kebidanan ', 'Lab Komputer', 'UAS Critical Analysis dan Promosi Kesehatan', '27-03-2023 11:42', '2023-05-19 09:40', '2023-05-19 11:15', '70', 'Selesai', '', '#0000FF'),
(1255, 101, 'Dina Anggraini', 'D4 Kebidanan', 'Lab Komputer', 'UAS Askeb Kasus Komplek, Anak Rentan, psikologi dan fatofisiologi', '27-03-2023 11:44', '2023-05-15 13:00', '2023-05-15 14:50', '76', 'Batal', 'Ujian SIMAMA Gelombang 2', '#000'),
(1256, 101, 'Dina Anggraini', 'D4 Kebidanan', 'Lab Komputer', 'UAS Praktik Profesional Bidan, Manajemen, Biorep, fisikes dan mikrobiologi', '27-03-2023 11:48', '2023-05-16 11:20', '2023-05-16 14:35', '76', 'Selesai', '', '#0000FF'),
(1257, 101, 'Dina Anggraini', 'D4 Kebidanan', 'Lab Komputer', 'UAS Fetomaternal, Pemberdayaan Masyarakat, IKK dan Manajemen', '27-03-2023 11:51', '2023-05-17 13:00', '2023-05-17 16:00', '76', 'Selesai', '', '#0000FF'),
(1258, 101, 'Dina Anggraini', 'D4 Kebidanan ', 'Lab Komputer', 'UAS Patient Safety, Komunitas, Critical Analysis dan EBM', '27-03-2023 11:54', '2023-05-19 11:20', '2023-05-19 14:20', '76', 'Selesai', '', '#0000FF'),
(1259, 101, 'Noviriyanti Arifin', 'D3 Keperawatan ', 'Lab Komputer', 'UTS Tingkat 1', '28-03-2023 14:20', '2023-03-29 08:30', '2023-03-29 10:00', '53', 'Selesai', '', '#0000FF'),
(1261, 105, 'Promosi Kesehatan', 'Poltekkes Kemenkes Bengkulu', 'Unit Pengembangan Bahasa', 'TOEFL Test', '29-03-2023 08:20', '2023-03-29 08:00', '2023-03-29 12:00', '72', 'Selesai', '', '#0000FF'),
(1262, 102, 'Melsa Putri Wulandari', 'Jurusan Gizi', 'Ruang Teater', 'Kuliah Kewirausahaa ', '29-03-2023 14:19', '2023-03-30 09:00', '2023-03-30 11:20', '40', 'Selesai', '', '#0000FF'),
(1263, 101, 'Dina Anggraini', 'D4 Kebidanan', 'Lab Komputer', 'Her UTS', '29-03-2023 21:00', '2023-03-30 09:00', '2023-03-30 11:00', '29', 'Selesai', '', '#0000FF'),
(1264, 101, 'Bobby Ardiansyah ', 'Jurusan Keperawatan (Str Keperawatan 2B)', 'Lab Komputer', 'Her UTS Maternitas ', '30-03-2023 19:46', '2023-03-31 14:00', '2023-03-31 16:00', '86', 'Selesai', '', '#0000FF'),
(1265, 101, 'Atek chartika', 'Str kep', 'Lab Komputer', 'Her uts maternitas', '31-03-2023 07:49', '2023-03-31 10:30', '2023-03-31 12:00', '62', 'Selesai', '', '#0000FF'),
(1267, 102, 'Rika Febrianti ', 'Str keperawatan ', 'Ruang Teater', 'Pembelajaran Patofisiologi ', '02-04-2023 11:41', '2023-04-04 08:00', '2023-04-04 10:00', '62', 'Selesai', '', '#0000FF'),
(1268, 102, 'Hanny Tri Anysha Pinem', 'Jurusan STR GIZI', 'Ruang Teater', 'Kuliah survailance', '04-04-2023 09:52', '2023-04-04 13:00', '2023-04-04 14:30', '40', 'Selesai', '', '#0000FF'),
(1270, 104, 'Tresia Agustiana ', 'D3 keperawatan ', 'Lab Osca', 'Tutorial maternitas ', '05-04-2023 08:16', '2023-04-05 08:30', '2023-04-05 10:00', '12', 'Selesai', '', '#0000FF'),
(1271, 102, 'Melsa Putri Wulandari', 'Jurusan Gizi', 'Ruang Teater', 'Kuliah Kewirausahaan', '05-04-2023 11:21', '2023-04-06 09:00', '2023-04-06 11:20', '40', 'Selesai', '', '#0000FF'),
(1272, 102, 'Yohana Pasaribu ', 'Poltekkes Kemenkes Bengkulu ', 'Ruang Teater', 'Ibadah Bulanan PMK', '05-04-2023 11:26', '2023-04-06 15:00', '2023-04-06 16:00', '50', 'Selesai', '', '#0000FF'),
(1273, 104, 'Refika duri', 'Poltekkes kemenkes bengkulu', 'Lab Osca', 'Tutorial', '06-04-2023 08:13', '2023-04-06 08:30', '2023-04-06 10:30', '13', 'Selesai', '', '#0000FF'),
(1274, 104, 'Fenina virny a', 'Poltekkes kemenkes bengkulu', 'Lab Osca', 'Tutorial vulva hygiene', '06-04-2023 08:32', '2023-04-06 08:33', '2023-04-06 08:33', '12', 'Selesai', '', '#0000FF'),
(1276, 102, 'RISA INDAH JULIANTI ', 'S.TR Gizi dan Dietetika ', 'Ruang Teater', 'Kuliah Etika Profesi 3A', '06-04-2023 10:44', '2023-04-06 13:00', '2023-04-06 14:30', '39', 'Selesai', '', '#0000FF'),
(1277, 104, 'Dinda meila putri', 'D3 Keperawatan', 'Lab Osca', 'Tutorial keperawatan maternitas', '06-04-2023 14:07', '2023-04-06 15:00', '2023-04-06 16:30', '12', 'Selesai', '', '#0000FF'),
(1279, 102, 'Rika Febrianti ', 'Str keperawatan ', 'Ruang Teater', 'Pembelajaran Patofisiologi ', '08-04-2023 21:56', '2023-04-11 08:00', '2023-04-11 10:00', '62', 'Selesai', '', '#0000FF'),
(1280, 101, 'Noviriyanti Arifin ', 'D3 Perawat Bengkulu', 'Lab Komputer', 'Remedial UTS tk.1', '09-04-2023 10:30', '2023-04-10 11:00', '2023-04-10 12:30', '53', 'Selesai', '', '#0000FF'),
(1281, 101, 'Noviriyanti Arifin ', 'D3Perawat ', 'Lab Komputer', 'Remedial UTS tk.1 dan 2', '09-04-2023 10:31', '2023-05-01 08:00', '2023-05-01 10:00', '97', 'Batal', 'Dikarenakan ada Ujian SIMAMA', '#FF0000'),
(1282, 101, 'Noviriyanti Arifin ', 'D3Perawat ', 'Lab Komputer', 'Remedial UTS tk.1 dan 2', '09-04-2023 10:33', '2023-05-02 08:00', '2023-05-02 10:00', '97', 'Batal', 'Dikarenakan ada Ujian SIMAMA', '#000'),
(1283, 101, 'Noviriyanti Arifin ', 'D3Perawat ', 'Lab Komputer', 'Remedial UTS tk.1 dan 2', '09-04-2023 10:34', '2023-05-03 08:00', '2023-05-03 10:00', '97', 'Batal', 'Dikarenakan ada Ujian SIMAMA', '#000'),
(1284, 101, 'Noviriyanti Arifin ', 'D3Perawat ', 'Lab Komputer', 'Remedial UTS tk.1 dan 2', '09-04-2023 10:35', '2023-05-04 08:00', '2023-05-04 10:00', '97', 'Batal', 'Dikarenakan ada Ujian SIMAMA', '#000'),
(1285, 101, 'Noviriyanti Arifin ', 'D3Perawat ', 'Lab Komputer', 'Remedial UTS tk.1 dan 2', '09-04-2023 10:36', '2023-05-05 09:00', '2023-05-05 10:00', '97', 'Batal', 'Dikarenakan ada Ujian SIMAMA', '#000'),
(1286, 101, 'Noviriyanti Arifin ', 'D3Perawat ', 'Lab Komputer', 'UAS tk.2', '09-04-2023 10:37', '2023-05-08 08:00', '2023-05-08 10:00', '97', 'Batal', 'Dikarenakan ada Ujian SIMAMA', '#000'),
(1287, 101, 'Noviriyanti Arifin ', 'D3Perawat ', 'Lab Komputer', 'UAS tk.2', '09-04-2023 10:38', '2023-05-09 08:00', '2023-05-09 10:00', '97', 'Selesai', '', '#0000FF'),
(1288, 101, 'Noviriyanti Arifin ', 'D3Perawat ', 'Lab Komputer', 'UAS tk.2', '09-04-2023 10:40', '2023-05-10 08:00', '2023-05-10 10:00', '97', 'Selesai', '', '#0000FF'),
(1289, 101, 'Noviriyanti Arifin ', 'D3Perawat ', 'Lab Komputer', 'UAS tk.2', '09-04-2023 10:41', '2023-05-11 08:00', '2023-05-11 10:00', '97', 'Selesai', '', '#0000FF'),
(1290, 101, 'Noviriyanti Arifin ', 'D3Perawat ', 'Lab Komputer', 'UAS tk.2', '09-04-2023 10:42', '2023-05-12 09:00', '2023-05-12 10:00', '97', 'Selesai', '', '#0000FF'),
(1292, 101, 'Farhand', 'D4 Promosi Kesehatan', 'Lab Komputer', 'UTS', '10-04-2023 09:13', '2023-04-11 12:00', '2023-04-11 13:10', '82', 'Selesai', '', '#0000FF'),
(1293, 101, 'Atek chartika', 'Str kep', 'Lab Komputer', 'Her b.inggris dan gizi dan diet', '10-04-2023 11:26', '2023-04-10 13:00', '2023-04-10 14:30', '62', 'Selesai', '', '#0000FF'),
(1294, 101, 'Atek chartika', 'Str keperawatan', 'Lab Komputer', 'Uas tk.1 metodologi keperawatan dan bahasa inggris I', '10-04-2023 11:27', '2023-05-22 10:00', '2023-05-22 11:30', '97', 'Batal', 'Ujian Kominfo', '#000'),
(1295, 101, 'Atek chartika', 'Str keperawatan', 'Lab Komputer', 'UAS Patofisiologi dan gizi dan diet', '10-04-2023 11:29', '2023-05-23 08:00', '2023-05-23 10:00', '97', 'Selesai', '', '#0000FF'),
(1296, 101, 'Atek Chartika', 'Str Keperawatan', 'Lab Komputer', 'UAS Manajemen Pasien Safety dan her b.inggris', '10-04-2023 11:30', '2023-05-24 08:00', '2023-05-24 10:00', '97', 'Selesai', '', '#0000FF'),
(1297, 101, 'Atek Chartika', 'Str Keperawatan', 'Lab Komputer', 'UAS Falsafah dan Teori Keperawatan dan her metodologi keperawatan', '10-04-2023 11:31', '2023-05-25 08:00', '2023-05-25 10:00', '97', 'Selesai', '', '#0000FF'),
(1298, 101, 'Atek Chartika', 'Str Keperawatan', 'Lab Komputer', 'UAS Keperawatan Dasar dan her Patofisiologi', '10-04-2023 11:33', '2023-05-26 08:00', '2023-05-26 10:00', '97', 'Selesai', '', '#0000FF'),
(1299, 101, 'Atek Chartika', 'Str keperawatan', 'Lab Komputer', 'UAS Keperawatan Anak dan her gizi dan diet', '10-04-2023 11:35', '2023-05-29 08:00', '2023-05-29 10:00', '87', 'Selesai', '', '#0000FF'),
(1300, 101, 'Atek Chartika', 'Str Keperawatan', 'Lab Komputer', 'UAS Keperawatan Medikal Bedah II dan Her Manajemen Pasien Safety tk.1', '10-04-2023 11:36', '2023-05-30 08:00', '2023-05-30 10:00', '87', 'Selesai', '', '#0000FF'),
(1301, 101, 'Atek Chartika', 'STR Keperawatan', 'Lab Komputer', 'UAS Keperawatan Maternitas dan Her falsafah dan Teori Keperawatan', '10-04-2023 11:38', '2023-05-31 08:00', '2023-05-31 10:00', '87', 'Selesai', '', '#0000FF'),
(1302, 101, 'Atek Chartika', 'STR Keperawatan', 'Lab Komputer', 'HER KMB II dan Keperawatan Anak', '10-04-2023 11:40', '2023-06-01 08:30', '2023-06-01 10:30', '87', 'Batal', 'LIBUR NASIONAL', '#000'),
(1303, 101, 'Atek Chartika', 'Str Keperawatan', 'Lab Komputer', 'Her UAS Keperawatan Maternitas dan Her Kepdas', '10-04-2023 11:40', '2023-06-02 09:00', '2023-06-02 11:50', '87', 'Batal', 'libur nasional', '#000'),
(1304, 101, 'Atek Chartika', 'Str Keperawatan', 'Lab Komputer', 'Her UAS  Keperawatan Komunitas', '10-04-2023 12:18', '2023-04-11 08:00', '2023-04-11 09:00', '47', 'Selesai', '', '#0000FF'),
(1305, 101, 'Noviriyanti Arifin ', 'D3Perawat ', 'Lab Komputer', 'Remedial UTS tk 1 ', '10-04-2023 17:53', '2023-04-11 13:00', '2023-04-11 14:00', '53', 'Selesai', '', '#0000FF'),
(1306, 102, 'Aldaffa Dwi Nugroho', 'Jurusan Gizi', 'Ruang Teater', 'MK Surveilans Gizi', '10-04-2023 19:49', '2023-04-11 08:00', '2023-04-11 11:20', '39', 'Batal', 'Sudah Dipinjam Jurusan lain', '#000'),
(1307, 101, 'Noviriyanti Arifin ', 'D3 Keperawatan', 'Lab Komputer', 'UAS Tingkat 1', '11-04-2023 08:35', '2023-06-05 09:00', '2023-06-05 10:00', '53', 'Selesai', '', '#0000FF'),
(1308, 101, 'Noviriyanti Arifin', 'D3 Keperawatan', 'Lab Komputer', 'UAS Tingkat 1', '11-04-2023 08:37', '2023-06-06 08:00', '2023-06-06 10:00', '53', 'Selesai', '', '#0000FF'),
(1309, 101, 'Noviriyanti Arifin', 'D3 Keperawatan', 'Lab Komputer', 'UAS Tingkat 1', '11-04-2023 08:38', '2023-06-07 09:00', '2023-06-07 10:00', '53', 'Selesai', '', '#0000FF'),
(1310, 101, 'Noviriyanti Arifin', 'D3 Keperawatan', 'Lab Komputer', 'UAS Tingkat 1', '11-04-2023 08:39', '2023-06-08 10:00', '2023-06-08 12:00', '53', 'Selesai', '', '#0000FF'),
(1311, 101, 'Noviriyanti Arifin', 'D3 Keperawatan', 'Lab Komputer', 'UAS Tingkat 1', '11-04-2023 08:40', '2023-06-09 10:00', '2023-06-09 12:00', '53', 'Selesai', '', '#0000FF'),
(1312, 102, 'Stevy Dhea Immanuel ', 'Str keperawatan rki tk 1', 'Ruang Teater', 'Pembelajaran patofisiologi ', '11-04-2023 12:45', '2023-04-11 13:00', '2023-04-11 14:40', '35', 'Selesai', '', '#0000FF'),
(1313, 101, 'Atek Chartika', 'STR keperawatan', 'Lab Komputer', 'Her uts patofisiologi', '12-04-2023 12:38', '2023-04-12 13:00', '2023-04-12 14:30', '97', 'Selesai', '', '#0000FF'),
(1314, 101, 'Atek chartika', 'Str keperawatan', 'Lab Komputer', 'Her uts kepdas', '13-04-2023 08:59', '2023-04-14 09:00', '2023-04-14 11:00', '97', 'Selesai', '', '#0000FF'),
(1315, 101, 'Atek chartika', 'Str keperawatan', 'Lab Komputer', 'Her uts kepdas', '13-04-2023 08:59', '2023-04-14 09:00', '2023-04-14 11:00', '97', 'Selesai', '', '#0000FF'),
(1316, 101, 'Atek chartika', 'Profesi ners', 'Lab Komputer', 'Ukom profesi', '13-04-2023 10:11', '2023-04-27 08:00', '2023-04-27 12:00', '50', 'Selesai', '', '#0000FF'),
(1317, 102, 'Annisa Nasywa Kamilah', 'Poltekkes Kemenkes Bengkulu', 'Ruang Teater', 'TO2HB', '13-04-2023 11:42', '2023-04-30 07:00', '2023-04-30 12:30', '80', 'Selesai', '', '#0000FF'),
(1318, 104, 'Via tamara', 'Poltekkes Kemenkes Bengkulu ', 'Lab Osca', 'Tutorial membantu bab bak', '13-04-2023 13:30', '2023-04-13 13:31', '2023-04-13 15:00', '52', 'Selesai', '', '#0000FF'),
(1319, 101, 'Noviriyanti Arifin', 'D3 Keperawatan', 'Lab Komputer', 'Remedial UTS Tingkat 1', '14-04-2023 09:46', '2023-04-14 11:00', '2023-04-14 12:00', '53', 'Selesai', '', '#0000FF'),
(1320, 101, 'Dina Anggraini', 'D4 Kebidanan', 'Lab Komputer', 'UAS Pancasila dan Psikologi', '27-04-2023 10:55', '2023-05-22 13:00', '2023-05-22 14:35', '98', 'Batal', 'Ujian Kominfo', '#000'),
(1321, 101, 'Dina Anggraini', 'D4 Kebidanan', 'Lab Komputer', 'UAS PDPK II', '27-04-2023 11:00', '2023-05-22 14:40', '2023-05-22 15:45', '70', 'Batal', 'Ujian Kominfo', '#000'),
(1323, 101, 'Dina Anggraini', 'D4 Kebidanan', 'Lab Komputer', 'UAS Fisiologi Kehamilan danBahasa Indonesia', '27-04-2023 11:06', '2023-05-24 10:00', '2023-05-24 12:00', '70', 'Selesai', '', '#0000FF'),
(1324, 101, 'Dina Anggraini', 'D4 Kebidanan', 'Lab Komputer', 'UAS Gizi Reproduksi dan Sosioantropologi', '27-04-2023 11:09', '2023-05-25 10:00', '2023-05-25 12:00', '70', 'Selesai', '', '#0000FF'),
(1325, 101, 'Dina Anggraini', 'D4 Kebidanan', 'Lab Komputer', 'UAS Fisika dan farmakologi', '27-04-2023 14:20', '2023-05-23 13:00', '2023-05-23 15:00', '98', 'Selesai', '', '#0000FF'),
(1326, 101, 'Dina Anggraini', 'D4 Kebidanan', 'Lab Komputer', 'UAS Askeb Remaja dan Perimenopause', '27-04-2023 14:22', '2023-05-23 15:00', '2023-05-23 16:00', '70', 'Selesai', '', '#0000FF');
INSERT INTO `meminjam` (`kode_pinjam`, `id_ruang`, `nama_peminjam`, `instansi_peminjam`, `nama_ruang`, `nama_kegiatan`, `tgl_pinjam`, `start_date`, `end_date`, `jumlah_mahasiswa`, `status`, `keterangan`, `color`) VALUES
(1327, 101, 'Dina Anggraini', 'D4 Kebidanan', 'Lab Komputer', 'UAS KB dan IKK', '27-04-2023 14:24', '2023-05-24 13:30', '2023-05-24 16:00', '70', 'Selesai', '', '#0000FF'),
(1328, 101, 'Dina Anggraini', 'D4 Kebidanan', 'Lab Komputer', 'UAS  Critical Analysis dan Promosi Kesehatan', '27-04-2023 14:26', '2023-05-25 13:00', '2023-05-25 16:00', '70', 'Selesai', '', '#0000FF'),
(1329, 101, 'Dina Anggraini', 'D4 Kebidanan', 'Lab Komputer', 'UAS EBM dan Askeb Pranikah', '27-04-2023 14:48', '2023-05-26 13:30', '2023-05-26 16:00', '70', 'Selesai', '', '#0000FF'),
(1330, 101, 'Afrizal', 'Jurusan Gizi', 'Lab Komputer', 'UAS MK SKP Tk II STr Gizi', '03-05-2023 15:08', '2023-05-22 08:00', '2023-05-22 08:40', '90', 'Batal', 'Ujian Kominfo', '#000'),
(1331, 101, 'Afrizal', 'Jurusan Gizi', 'Lab Komputer', 'UAS MK Manajemen Tk I STr', '03-05-2023 15:15', '2023-06-19 08:00', '2023-06-19 10:00', '90', 'Selesai', '', '#0000FF'),
(1332, 101, 'Afrizal', 'Tk I STr', 'Lab Komputer', 'UAS MK Komunikasi', '03-05-2023 15:16', '2023-06-19 10:00', '2023-06-19 12:00', '90', 'Selesai', '', '#0000FF'),
(1333, 101, 'Afrizal', 'Tk I STr', 'Lab Komputer', 'UAS MK GDDK', '03-05-2023 15:21', '2023-06-20 08:00', '2023-06-20 10:00', '90', 'Selesai', '', '#0000FF'),
(1334, 101, 'Afrizal', 'Tk I STr', 'Lab Komputer', 'UAS MK Kimia Pangan', '03-05-2023 15:22', '2023-06-20 10:00', '2023-06-20 12:00', '90', 'Selesai', '', '#0000FF'),
(1336, 101, 'Afrizal', 'Tk I STr', 'Lab Komputer', 'UAS MK Sos Antro', '03-05-2023 15:24', '2023-06-21 10:00', '2023-06-21 12:00', '90', 'Selesai', '', '#0000FF'),
(1337, 101, 'Afrizal', 'Tk I STr', 'Lab Komputer', 'UAS MK Mikrobiologi', '03-05-2023 15:25', '2023-06-22 08:00', '2023-06-22 10:00', '90', 'Selesai', '', '#0000FF'),
(1340, 101, 'AFRIZAL', 'TK III STr', 'Lab Komputer', 'UAS MK CRTICALL ILL', '03-05-2023 15:37', '2023-06-05 13:00', '2023-06-05 14:00', '80', 'Selesai', '', '#0000FF'),
(1341, 101, 'Afrizal', 'Tk III STr', 'Lab Komputer', 'UAS MK Etika Profesi', '03-05-2023 15:47', '2023-06-06 13:00', '2023-06-06 14:00', '80', 'Selesai', '', '#0000FF'),
(1342, 101, 'Afrizal', 'Tk III Prodi STr', 'Lab Komputer', 'UAS MK Kewirausahaan', '03-05-2023 15:48', '2023-06-06 14:00', '2023-06-06 16:00', '80', 'Selesai', '', '#0000FF'),
(1343, 102, 'STR GIZI 3 A&B', 'Jurusan gizi', 'Ruang Teater', 'Kuliah Kewirahusahaan', '04-05-2023 11:51', '2023-05-05 09:00', '2023-05-05 11:00', '79', 'Selesai', '', '#0000FF'),
(1344, 102, 'Febri Andri awan', 'Jurusan Gizi', 'Ruang Teater', 'Kuliah Kewirausahaan ', '05-05-2023 13:14', '2023-05-05 13:30', '2023-05-05 15:30', '79', 'Selesai', '', '#0000FF'),
(1345, 102, 'Ramdhan Noer Ikhsan', 'D3 Keperawatan Bengkulu', 'Ruang Teater', 'Bimbel TO UKOM', '08-05-2023 09:36', '2023-05-08 07:56', '2023-05-08 16:30', '86', 'Selesai', '', '#0000FF'),
(1346, 102, 'Yuke Firdahaliza ', 'STR keperawatan TK.1 reguler ', 'Ruang Teater', 'Pembelajaran ', '08-05-2023 20:09', '2023-05-09 08:00', '2023-05-09 10:10', '62', 'Selesai', '', '#0000FF'),
(1347, 102, 'Yuke Firdahaliza ', 'Str keperawatan TK.1 reguler ', 'Ruang Teater', 'Pembelajaran ', '08-05-2023 20:11', '2023-05-09 08:00', '2023-05-09 10:10', '62', 'Selesai', '', '#0000FF'),
(1348, 102, 'Ramdhan Noer Ikhsan', 'D3 Keperawatan Bengkulu', 'Ruang Teater', 'Bimbel Ukom', '09-05-2023 09:43', '2023-05-09 10:00', '2023-05-09 13:30', '86', 'Selesai', '', '#0000FF'),
(1349, 102, 'UKM PMK', 'POLTEKKES KEMENKES BENGKULU ', 'Ruang Teater', 'Ibadah Bulanan PMK Polkeslu', '09-05-2023 15:19', '2023-05-10 15:30', '2023-05-10 16:30', '50', 'Batal', '', '#000'),
(1350, 102, 'Eksandi', 'Poltekkes kemenkes bengkulu', 'Ruang Teater', 'bimbel ukom', '10-05-2023 06:55', '2023-05-10 10:00', '2023-05-10 13:00', '86', 'Selesai', '', '#0000FF'),
(1351, 102, 'Feby Desnita Nainggolan ', 'BEM-KM Poltekkes Kemenkes Bengkulu ', 'Ruang Teater', 'Perlombaan jingle', '10-05-2023 09:21', '2023-05-10 11:00', '2023-05-10 15:45', '10', 'Selesai', '', '#0000FF'),
(1352, 102, 'Eksandi', 'D3 keperawatan', 'Ruang Teater', 'bimbel ukom', '10-05-2023 12:35', '2023-05-10 13:30', '2023-05-10 17:00', '86', 'Selesai', '', '#0000FF'),
(1353, 102, 'Eda Setia Ningsih', 'Poltekkes kemenkes bengkulu', 'Ruang Teater', 'Bimbem UKOM D3', '10-05-2023 20:31', '2023-05-11 13:00', '2023-05-11 16:00', '85', 'Selesai', '', '#0000FF'),
(1354, 102, 'Muhammad Izzuddin Al Fathi ', 'Poltekkes Kemenkes Bengkulu ', 'Ruang Teater', 'Sosialisasi aplikasi pembelajaran ', '11-05-2023 07:54', '2023-05-11 08:00', '2023-05-11 12:00', '53', 'Selesai', '', '#0000FF'),
(1355, 102, 'Bobby Ardiansyah ', 'Putra Putri Kampus Poltekkes Kemenkes Bengkulu ', 'Ruang Teater', 'Karantina dan tes Bakat ', '11-05-2023 11:07', '2023-05-12 07:30', '2023-05-12 16:00', '30', 'Selesai', '', '#0000FF'),
(1356, 102, 'Muhammad zachri ', 'Rotashih Poltekkes Kemenkes Bengkulu ', 'Ruang Teater', 'Halal bihalal ', '11-05-2023 19:52', '2023-05-13 07:00', '2023-05-13 12:00', '70', 'Selesai', '', '#0000FF'),
(1357, 104, 'Tresia Agustiana ', 'D3 Keperawatan ', 'Lab Osca', 'Osca KMB 2', '12-05-2023 14:00', '2023-05-15 07:00', '2023-05-16 16:00', '98', 'Selesai', '', '#0000FF'),
(1358, 102, 'Mufidah azizah', 'HMJ Analis Kesehatan ', 'Ruang Teater', 'Bimbingan Karya Tulis Ilmiah (BKTI) dan Kelas IT', '13-05-2023 14:26', '2023-05-27 07:00', '2023-05-27 12:00', '70', 'Selesai', '', '#0000FF'),
(1359, 102, 'Muhammad Rafli Adrian', 'jurusan keperawatan', 'Ruang Teater', 'Sosialisasi Aplikasi Pembelajaran', '16-05-2023 11:18', '2023-05-16 14:30', '2023-05-16 17:00', '98', 'Selesai', '', '#0000FF'),
(1363, 102, 'Muhammad Fachri', 'UKM Rotashih', 'Ruang Teater', 'Training Kepemimpinan', '18-05-2023 13:10', '2023-05-20 06:00', '2023-05-20 17:00', '60', 'Selesai', '', '#0000FF'),
(1364, 101, 'Noviriyanti Arifin ', 'D3 Keperawatan ', 'Lab Komputer', 'Remedial UTS tk 2', '18-05-2023 20:04', '2023-05-19 14:30', '2023-05-19 16:00', '96', 'Selesai', '', '#0000FF'),
(1365, 101, 'Lissa Ervina', 'STR Promkes', 'Lab Komputer', 'UTS Tk 1 dan 2 Promkes', '18-05-2023 21:45', '2023-05-23 10:00', '2023-05-23 12:00', '98', 'Selesai', '', '#0000FF'),
(1366, 101, 'Lissa Ervina', 'STR Promkes', 'Lab Komputer', 'UTS Tk 1 dan 2 Promkes', '18-05-2023 21:52', '2023-05-26 10:00', '2023-05-26 12:00', '98', 'Selesai', '', '#0000FF'),
(1367, 102, 'Lissa Ervina', 'STR Promkes', 'Ruang Teater', 'UTS Tk 1 dan 2 Promkes', '18-05-2023 21:54', '2023-05-22 09:00', '2023-05-22 15:00', '98', 'Selesai', 'Ujian Kominfo', '#0000FF'),
(1368, 102, 'Lissa Ervina', 'STR Promkes', 'Ruang Teater', 'UTS Tk 1 dan 2 Promkes', '18-05-2023 21:56', '2023-05-23 13:00', '2023-05-23 16:00', '98', 'Selesai', '', '#0000FF'),
(1369, 102, 'Lissa Ervina', 'STR Promkes', 'Ruang Teater', 'UTS Tk 1 dan 2 Promkes', '18-05-2023 21:58', '2023-05-24 09:00', '2023-05-24 16:00', '98', 'Selesai', 'Telah Digunakan Prodi Lain', '#0000FF'),
(1370, 102, 'Lissa Ervina', 'STR Promkes', 'Ruang Teater', 'UTS Tk 1 dan 2 Promkes', '18-05-2023 21:59', '2023-05-25 09:00', '2023-05-25 16:00', '98', 'Selesai', 'Telah digunakan Prodi Lain', '#0000FF'),
(1371, 102, 'Lissa Ervina', 'STR Promkes', 'Ruang Teater', 'UTS Tk 1 dan 2 Promkes', '18-05-2023 22:00', '2023-05-26 13:00', '2023-05-26 16:00', '98', 'Selesai', '', '#0000FF'),
(1372, 102, 'Kartika Candra Agustina', 'Keperawatan Poltekkes Kemenkes Bengkulu', 'Ruang Teater', 'Sosialisasi JTC ', '19-05-2023 09:29', '2023-05-19 12:30', '2023-05-19 14:30', '41', 'Selesai', '', '#0000FF'),
(1373, 104, 'Riski aljundi', 'D3 keperawatan', 'Lab Osca', 'Osca keperawatan anak', '19-05-2023 10:59', '2023-05-22 07:00', '2023-05-22 16:00', '96', 'Disetujui', '', '#FF0000'),
(1374, 101, 'Linda Fitri  Astuti', 'TLM', 'Lab Komputer', 'Ujian Kewarganegaraan UAS semester Genap 2022/2023', '22-05-2023 09:49', '2023-05-29 14:00', '2023-05-29 15:00', '110', 'Selesai', '', '#0000FF'),
(1375, 101, 'Linda Fitri Astuti', 'TLM', 'Lab Komputer', 'Ujian UAS Bakteriologi 3 Semester Genap TA 2022/2023', '22-05-2023 09:53', '2023-05-29 15:00', '2023-05-29 16:00', '106', 'Selesai', '', '#0000FF'),
(1376, 101, 'Nadia', 'D3 Farmasi Poltekkes Kemenkes Bengkulu', 'Lab Komputer', 'Ujian Akhir Semester', '22-05-2023 10:40', '2023-05-29 08:20', '2023-05-29 10:00', '97', 'Batal', '', '#000'),
(1377, 101, 'Linda Fitri Astuti', 'TLM', 'Lab Komputer', 'Ujian UAS biosel semester Genap TA 2022/2023', '22-05-2023 11:13', '2023-05-30 13:00', '2023-05-30 15:00', '110', 'Selesai', '', '#0000FF'),
(1378, 102, 'Noviriyanti Arifin', 'Prodi D3 Keperawatan', 'Ruang Teater', 'Ujian Remedial UAS Tk. 2', '22-05-2023 12:54', '2023-05-23 08:00', '2023-05-23 11:00', '98', 'Selesai', '', '#0000FF'),
(1379, 101, 'AIPTLMI', 'AIPTLMI', 'Lab Komputer', 'TO UKOM TLM', '22-05-2023 13:36', '2023-06-12 08:00', '2023-06-12 16:00', '120', 'Selesai', '', '#0000FF'),
(1380, 101, 'AIPTLMI', 'AIPTLMI', 'Lab Komputer', 'TO UKOM TLM', '22-05-2023 13:39', '2023-06-13 08:00', '2023-06-13 16:00', '120', 'Selesai', '', '#0000FF'),
(1381, 102, 'Ns. Septiyanti, S.Kep., M.Pd', 'Poltekkes kemenkes Bengkulu', 'Ruang Teater', 'Sosialisasi Kerja Luar Negeri', '23-05-2023 11:30', '2023-05-24 07:30', '2023-05-24 13:00', '90', 'Selesai', '', '#0000FF'),
(1383, 102, 'Haris fadhilah akip', 'D3 keperawatan ', 'Ruang Teater', 'Pembekalaan PKK Kep.materintas TK2', '24-05-2023 20:50', '2023-05-25 07:20', '2023-05-25 09:00', '97', 'Selesai', '', '#0000FF'),
(1384, 102, 'Nahprecelia Muharromah ', 'Str keperawatan tingkat 3', 'Ruang Teater', 'Pembekalan PKK kmb 3', '25-05-2023 13:57', '2023-05-30 08:00', '2023-05-30 12:00', '47', 'Selesai', '', '#28a745'),
(1385, 101, 'LUPUS', 'KESLING', 'Lab Komputer', 'UAS', '26-05-2023 10:57', '2023-06-07 13:30', '2023-06-07 16:00', '72', 'Selesai', '', '#0000FF'),
(1386, 101, 'LUPUS', 'KESLING', 'Lab Komputer', 'UAS KESLING', '26-05-2023 10:59', '2023-06-08 13:30', '2023-06-08 16:00', '72', 'Selesai', '', '#0000FF'),
(1387, 101, 'LUPUS', 'KESLING', 'Lab Komputer', 'UAS KESLING', '26-05-2023 11:01', '2023-06-09 13:30', '2023-06-09 16:30', '72', 'Selesai', '', '#0000FF'),
(1388, 101, 'LUPUS', 'KESLING', 'Lab Komputer', 'UAS KESLING', '26-05-2023 11:03', '2023-06-14 13:30', '2023-06-14 16:00', '82', 'Selesai', '', '#0000FF'),
(1389, 101, 'LUPUS', 'KESLING', 'Lab Komputer', 'UAS KESLING', '26-05-2023 11:06', '2023-06-15 13:30', '2023-06-15 16:00', '82', 'Selesai', '', '#0000FF'),
(1390, 101, 'LUPUS', 'KESLING', 'Lab Komputer', 'UAS KESLING', '26-05-2023 11:08', '2023-06-16 13:30', '2023-06-16 16:30', '82', 'Selesai', '', '#0000FF'),
(1391, 101, 'LUPUS', 'KESLING', 'Lab Komputer', 'UAS KESLING', '26-05-2023 11:12', '2023-06-19 13:30', '2023-06-19 16:00', '82', 'Selesai', '', '#0000FF'),
(1392, 101, 'LUPUS', 'KESLING', 'Lab Komputer', 'UAS KESLING', '26-05-2023 11:13', '2023-06-20 13:30', '2023-06-20 16:00', '82', 'Selesai', '', '#0000FF'),
(1393, 101, 'LUPUS', 'KESLING', 'Lab Komputer', 'UAS KESLING', '26-05-2023 11:14', '2023-06-21 13:30', '2023-06-21 16:00', '82', 'Selesai', '', '#0000FF'),
(1394, 101, 'LUPUS', 'KESLING', 'Lab Komputer', 'UAS KESLING', '26-05-2023 11:15', '2023-06-22 13:30', '2023-06-22 16:00', '82', 'Selesai', '', '#0000FF'),
(1395, 101, 'LUPUS', 'KESLING', 'Lab Komputer', 'UAS KESLING', '26-05-2023 11:17', '2023-06-23 13:30', '2023-06-23 13:30', '82', 'Batal', 'TO UKOM', '#000'),
(1396, 102, 'Dymas Kurniawan', 'Str Keperawatan TK 2', 'Ruang Teater', 'Pembekalan PKK KMB 1', '26-05-2023 21:44', '2023-05-29 13:30', '2023-05-29 16:00', '86', 'Selesai', '', '#0000FF'),
(1397, 101, 'Nadia Farmasi', 'D3 Farmasi', 'Lab Komputer', 'UAS Manajemen dan Akuntansi', '27-05-2023 21:11', '2023-05-30 10:00', '2023-05-30 12:00', '82', 'Selesai', '', '#0000FF'),
(1398, 102, 'Dymas Kurniawan', 'Str Keperawatan tk 2', 'Ruang Teater', 'Pembekalan PKK KMB 1', '28-05-2023 18:27', '2023-05-29 08:00', '2023-05-29 12:00', '86', 'Selesai', '', '#0000FF'),
(1399, 101, 'AZAHRA KHAIRUNNISA', 'JURUSAN PROMOSI KESEHATAN POLTEKKES KEMENKES BENGK', 'Lab Komputer', 'UJIAN PRAKTIK SISTEM INFORMASI KESEHATAN', '28-05-2023 19:34', '2023-05-29 09:00', '2023-05-29 10:30', '40', 'Batal', '', '#28a745'),
(1400, 101, 'AZAHRA KHAIRUNNISA', 'JURUSAN PROMOSI KESEHATAN POLTEKKES KEMENKES BENGK', 'Lab Komputer', 'UJIAN PRAKTIK SISTEM INFORMASI KESEHATAN TINGKAT 2B', '28-05-2023 19:40', '2023-05-29 09:00', '2023-05-29 10:30', '40', 'Batal', '', '#28a745'),
(1401, 101, 'Nadia', 'D3 Farmasi', 'Lab Komputer', 'UAS Kewarganegaraan (Revisi peminjaman Ruang)', '28-05-2023 20:59', '2023-05-29 10:00', '2023-05-29 12:00', '97', 'Selesai', '', '#0000FF'),
(1402, 101, 'Nadia D3 Farmasi ', 'D3 Farmasi', 'Lab Komputer', 'UAS Kewarganegaraan (revisi jadwal yang tabrakan)', '28-05-2023 21:02', '2023-05-29 10:00', '2023-05-29 11:00', '97', 'Batal', '', '#000'),
(1403, 101, 'Nadia ', 'D3 Farmasi', 'Lab Komputer', 'UAS IKM', '28-05-2023 21:09', '2023-06-07 10:00', '2023-06-07 12:00', '97', 'Selesai', '', '#0000FF'),
(1404, 101, 'Linda Fitri Astuti', 'TLM', 'Lab Komputer', 'Ujian UAS GENAP Urinalisa dan Hematologi', '29-05-2023 08:19', '2023-05-31 10:00', '2023-05-31 12:00', '106', 'Selesai', '', '#0000FF'),
(1407, 102, 'Eggy Lestasi ', 'Poltekkes Kemenkes Bengkulu ', 'Ruang Teater', 'Bimbel Ukom D3 Kep', '30-05-2023 03:49', '2023-05-30 08:00', '2023-05-30 12:00', '86', 'Selesai', '', '#28a745'),
(1408, 101, 'LPUK', 'TO UKOM', 'Lab Komputer', 'TO UKOM', '31-05-2023 08:42', '2023-06-23 08:00', '2023-06-23 16:00', '120', 'Selesai', '', '#0000FF'),
(1409, 101, 'LPUK', 'LPUK', 'Lab Komputer', 'TO UKOM', '31-05-2023 08:43', '2023-06-24 08:00', '2023-06-25 16:00', '120', 'Selesai', '', '#0000FF'),
(1410, 101, 'LINDA FITRI ASTUTI', 'D3 TLM', 'Lab Komputer', 'UJIAN  UAS PARASITOLOGI DAN MIKOLOGI', '31-05-2023 14:40', '2023-06-05 10:00', '2023-06-05 12:00', '106', 'Selesai', '', '#0000FF'),
(1411, 101, 'LINDA FITRI ASTUTI', 'TLM', 'Lab Komputer', 'UJIAN UAS KIMIA KLINIK DAN SITOHISTOTEKNOLOGI', '31-05-2023 14:44', '2023-06-06 10:00', '2023-06-06 12:00', '106', 'Selesai', '', '#0000FF'),
(1412, 102, 'M. ANUGRAH SUPRYADI', 'UKM PADUS GSM', 'Ruang Teater', 'OPEN RECRUITMENT ', '15-08-2023 11:24', '2023-08-15 15:30', '2023-08-15 19:30', '40', 'Selesai', '', '#28a745'),
(1416, 101, 'DINA ANGGRAINI', 'D4 Kebidanan', 'Laboratorium Komputer', 'UTS Praktik Kebidanan dan Pelayanan Kebidanan', '16-08-2023 09:25', '2023-09-04 14:00', '2023-09-04 16:00', '120', 'Selesai', '', '#0000FF'),
(1426, 102, 'Eksandi', 'D3 keperawatan', 'Ruang Teater', 'bimbel ukom', '16-08-2023 10:20', '2023-08-16 13:20', '2023-08-16 16:00', '86', 'Selesai', '', '#0000FF'),
(1428, 101, 'DINA ANGGRAINI', 'D4 Kebidanan', 'Laboratorium Komputer', 'UTS Mikrobiologi, Parsitologi dan Pengantar Praktik Kebidanan', '16-08-2023 10:33', '2023-09-07 08:00', '2023-09-07 10:00', '92', 'Selesai', '', '#0000FF'),
(1433, 102, 'Nanda suci rahma dani', 'Poltekkes Kemenkes Bengkulu Prodi teknologi labora', 'Ruang Teater', 'mata kuliah gabung b.iggris ', '16-08-2023 11:50', '2023-08-18 13:00', '2023-08-18 16:00', '104', 'Batal', 'Ada UKOM', '#000'),
(1434, 101, 'Dian Natasya Cahaya Fitriani ', 'D3 Farmasi', 'Laboratorium Komputer', 'TRY OUT INTERNAL', '16-08-2023 12:02', '2023-08-16 13:00', '2023-08-16 16:00', '61', 'Selesai', '', '#28a745'),
(1435, 102, 'Bobby Ardiansyah ', 'Str TK 3 B keperawatan ', 'Ruang Teater', 'Seminar PKK KMB II ', '17-08-2023 20:20', '2023-08-18 08:00', '2023-08-18 16:00', '88', 'Batal', 'Ada UKOM', '#000'),
(1436, 102, 'Gibrina ', 'Jurusan gizi ', 'Ruang Teater', 'Kuliahan ', '22-08-2023 08:34', '2023-08-22 10:00', '2023-08-21 13:00', '88', 'Selesai', '', '#0000FF'),
(1438, 101, 'Noviriyanti Arifin', 'Prodi D3 Keperawatan ', 'Laboratorium Komputer', 'UTS tingkat 2', '22-08-2023 08:40', '2023-08-28 08:00', '2023-08-28 10:00', '54', 'Selesai', '', '#0000FF'),
(1439, 101, 'Noviriyanti Arifin', 'Prodi D3 Keperawatan', 'Laboratorium Komputer', 'UTS tingkat 2', '22-08-2023 08:41', '2023-08-29 08:00', '2023-08-29 10:00', '54', 'Selesai', '', '#0000FF'),
(1440, 101, 'Noviriyanti Arifin', 'Prodi D3 Keperawatan', 'Laboratorium Komputer', 'UTS tingkat 2', '22-08-2023 08:42', '2023-08-30 08:00', '2023-08-30 10:00', '54', 'Selesai', '', '#0000FF'),
(1441, 101, 'Noviriyanti Arifin', 'Prodi D3 Keperawatan', 'Laboratorium Komputer', 'UTS tingkat 2', '22-08-2023 08:43', '2023-08-31 08:00', '2023-08-31 10:00', '54', 'Selesai', '', '#0000FF'),
(1451, 101, 'Atek Chartika', 'STR Keperawatan', 'Laboratorium Komputer', 'UTS TK.1', '22-08-2023 09:19', '2023-09-05 08:00', '2023-09-05 10:00', '78', 'Selesai', '', '#0000FF'),
(1459, 102, 'UKM PADUS POLKESLU ', 'POLTEKKES KEMENKES BENGKULU ', 'Ruang Teater', 'LATIHAN RUTIN UKM PADUS', '22-08-2023 14:26', '2023-08-22 15:30', '2023-08-22 19:30', '45', 'Selesai', '', '#0000FF'),
(1460, 102, 'Farhand', 'Promosi Kesehatan', 'Ruang Teater', 'Kuliah PBAK', '22-08-2023 19:12', '2023-08-25 13:00', '2023-08-25 15:30', '45', 'Selesai', '', '#0000FF'),
(1461, 102, 'Dwi Wulandari, Ners, S. Kep., MAN', 'Poltekkes Bengkulu', 'Ruang Teater', 'Interview Jepang', '23-08-2023 08:31', '2023-08-23 08:30', '2023-08-23 16:00', '50', 'Selesai', '', '#0000FF'),
(1462, 102, 'Dewi', 'Jurusan Gizi', 'Ruang Teater', 'Kuliah Statistika ', '23-08-2023 11:23', '2023-08-24 13:00', '2023-08-24 16:00', '48', 'Selesai', '', '#0000FF'),
(1463, 102, 'Ns. Kheli Fitria Annuril, S.Kep', 'Keperawatan Bengkulu', 'Ruang Teater', 'Mengajar', '24-08-2023 08:43', '2023-08-24 08:30', '2023-08-24 12:00', '63', 'Selesai', '', '#0000FF'),
(1465, 102, 'Verly Prisilia', 'Jurusan Gizi', 'Ruang Teater', 'Briefing OSCE', '24-08-2023 10:38', '2023-08-25 09:00', '2023-08-25 12:00', '100', 'Selesai', '', '#0000FF'),
(1466, 102, 'UKM PADUS POLKESLU ', 'POLTEKKES KEMENKES BENGKULU ', 'Ruang Teater', 'LATIHAN RUTIN UKM PADUS ', '24-08-2023 13:30', '2023-08-24 15:30', '2023-08-24 19:30', '45', 'Selesai', '', '#0000FF'),
(1467, 102, 'PUTRI INDAH LESTARI', '3A,B D3 keperawatan ', 'Ruang Teater', 'Perkuliahan Metlit', '25-08-2023 06:19', '2023-08-25 07:45', '2023-08-25 09:00', '96', 'Selesai', '', '#0000FF'),
(1469, 102, 'Vioni Nurhasanah ', 'Gizi', 'Ruang Teater', 'Pembelajaran Biokimia', '29-08-2023 07:36', '2023-08-30 13:00', '2023-08-30 16:40', '96', 'Selesai', '', '#0000FF'),
(1470, 102, 'Danni Puspita Arizona ', 'Keperawatan mam widia ', 'Ruang Teater', 'Pembelajaran ', '29-08-2023 07:42', '2023-08-29 08:00', '2023-08-29 11:30', '80', 'Selesai', '', '#0000FF'),
(1471, 102, 'Abillah Almubaroqah', 'Polkeslu', 'Ruang Teater', 'PRAKTIK SIK', '29-08-2023 11:30', '2023-08-29 13:00', '2023-08-29 16:00', '98', 'Selesai', '', '#0000FF'),
(1472, 102, 'Abillah Almubaroqah', 'Polkeslu', 'Ruang Teater', 'PRAKTIK SIK', '29-08-2023 11:30', '2023-08-29 13:00', '2023-08-29 16:00', '98', 'Selesai', '', '#0000FF'),
(1473, 102, 'UKM PADUS POLKESLU ', 'POLTEKKES KEMENKES BENGKULU ', 'Ruang Teater', 'LATIHAN RUTIN UKM PADUS ', '29-08-2023 14:39', '2023-08-29 16:00', '2023-08-29 19:30', '45', 'Selesai', '', '#0000FF'),
(1474, 102, 'Ikat Tri Hawani', 'Poltekkes Kemenkes Bengkulu ', 'Ruang Teater', 'Kuliah pgd', '30-08-2023 12:02', '2023-08-30 13:00', '2023-08-30 15:30', '88', 'Selesai', '', '#0000FF'),
(1475, 102, 'Anditha', 'Prodi Pendidikan Profesi Ners', 'Ruang Teater', 'Serah Terima Mahasiswa', '30-08-2023 14:06', '2023-08-31 08:00', '2023-08-31 15:00', '34', 'Selesai', '', '#0000FF'),
(1476, 102, 'Maghfira Ramadhania ', 'Poltekkes Kemenkes ', 'Ruang Teater', 'Perkuliahan Gadar', '31-08-2023 13:38', '2023-08-31 13:40', '2023-08-31 16:00', '49', 'Selesai', '', '#0000FF'),
(1477, 102, 'Maghfira Ramadhania ', 'Poltekkes Kemenkes ', 'Ruang Teater', 'Perkuliahan Gadar', '31-08-2023 13:38', '2023-08-31 13:40', '2023-08-31 16:00', '49', 'Selesai', '', '#0000FF'),
(1478, 102, 'Farhand', 'D4 Promosi Kesehatan', 'Ruang Teater', 'Presentasi Magang Institusi', '03-09-2023 15:49', '2023-09-04 10:00', '2023-09-04 15:00', '80', 'Selesai', '', '#0000FF'),
(1479, 102, 'Lissa Ervina', 'Promkes', 'Ruang Teater', 'Presentasi Praktik Kerja Lapangan', '03-09-2023 16:01', '2023-09-04 08:00', '2023-09-04 16:00', '70', 'Selesai', '', '#0000FF'),
(1482, 101, 'Noviriyanti Arifin', 'Prodi D3 Keperawatan', 'Laboratorium Komputer', 'UTS Mahasiswa Tk.3', '04-09-2023 09:57', '2023-09-13 08:00', '2023-09-13 10:00', '96', 'Selesai', '', '#0000FF'),
(1486, 101, 'Nadia', 'D3 Farmasi', 'Laboratorium Komputer', 'UTS Tk 1 PIF', '04-09-2023 21:32', '2023-09-08 14:00', '2023-09-08 14:50', '109', 'Selesai', '', '#0000FF'),
(1487, 102, 'Indo Putra Ali Dayanto ', 'Jurusan keperawatan STR TK 2', 'Ruang Teater', 'UTS PBAK ', '05-09-2023 08:01', '2023-09-05 13:00', '2023-09-05 15:00', '98', 'Selesai', '', '#0000FF'),
(1488, 102, 'Maghfira Ramadhania ', 'Poltekkes Kemenkes Bengkulu ', 'Ruang Teater', 'Perkuliahan ', '05-09-2023 08:08', '2023-09-05 08:08', '2023-09-05 11:00', '49', 'Selesai', '', '#0000FF'),
(1489, 102, 'Farhand', 'D4 Promosi Kesehatan', 'Ruang Teater', 'Simulasi  UKOM', '05-09-2023 09:21', '2023-09-07 13:00', '2023-09-07 16:00', '75', 'Selesai', '', '#0000FF'),
(1491, 102, 'Gita nurrisyah asri', 'D3 TLM', 'Ruang Teater', 'Perkuliahan', '05-09-2023 13:49', '2023-09-06 08:00', '2023-09-06 12:00', '50', 'Selesai', '', '#0000FF'),
(1492, 102, 'Ismiati, SKM, M.Kes', 'Hmj Promosi Kesehatan', 'Ruang Teater', 'Meet and Greet', '06-09-2023 08:39', '2023-09-09 07:00', '2023-09-09 13:00', '100', 'Batal', 'Simulasi ukom promkes', '#000'),
(1493, 102, 'Ismiati, SKM, M.Kes', 'Hmj Promosi Kesehatan', 'Ruang Teater', 'Meet and Greet', '06-09-2023 08:45', '2023-09-08 07:00', '2023-09-08 18:00', '100', 'Batal', '', '#000'),
(1494, 102, 'Bobby ', 'Keperawatan ', 'Ruang Teater', 'Rapat Koordinasi keperawatan ', '06-09-2023 14:22', '2023-09-06 15:00', '2023-09-06 18:00', '80', 'Selesai', '', '#0000FF'),
(1495, 102, 'Farhand', 'D4 Promosi Kesehatan', 'Ruang Teater', 'Simulasi UKOM Promkes', '06-09-2023 15:31', '2023-09-07 09:00', '2023-09-07 12:00', '75', 'Selesai', '', '#0000FF'),
(1496, 102, 'Ismiati, SKM., M.Kes', 'Hmj Promosi Kesehatan', 'Ruang Teater', 'Gladi bersih Meet and Greet promkes', '07-09-2023 10:34', '2023-09-07 13:00', '2023-09-06 16:00', '40', 'Batal', '', '#000'),
(1497, 102, 'Ismiati, SKM., M.Kes', 'Hmj Promosi Kesehatan ', 'Ruang Teater', 'Meet and Greet hmj promkes', '07-09-2023 10:44', '2023-09-09 07:00', '2023-09-09 15:00', '100', 'Selesai', '', '#0000FF'),
(1498, 102, 'Ismiati, SKM., M.Kes', 'Hmj Promosi Kesehatan', 'Ruang Teater', 'Meet and Greet hmj promkes', '07-09-2023 12:42', '2023-09-08 16:00', '2023-09-08 18:00', '35', 'Selesai', '', '#0000FF'),
(1499, 102, 'sahidan, M.Kes', 'HMJ Analis Kesehatan', 'Ruang Teater', 'PKW & MABIM', '11-09-2023 10:26', '2023-09-23 06:00', '2023-09-23 16:00', '60', 'Selesai', '', '#0000FF'),
(1500, 102, 'D3 Gizi', 'POLTEKKES KEMENKES BENGKULU ', 'Ruang Teater', 'Kuliah', '11-09-2023 15:23', '2023-09-13 13:00', '2023-09-13 16:00', '60', 'Selesai', '', '#0000FF'),
(1501, 102, 'UKM PADUS', 'POLTEKKES KEMENKES BENGKULU ', 'Ruang Teater', 'LATIHAN PADUS WISUDA ', '12-09-2023 14:42', '2023-09-12 15:00', '2023-09-12 21:00', '50', 'Selesai', '', '#0000FF'),
(1502, 101, 'Jaksen sadri,', 'polkeslu', 'Laboratorium Komputer', 'belajar tik', '12-09-2023 14:59', '2023-09-13 10:00', '2023-09-13 11:30', '40', 'Selesai', '', '#0000FF'),
(1503, 102, 'NOVIRIYANTI ARIFIN', 'D3 KEPERAWATAN', 'Ruang Teater', 'Briefing OSCE', '13-09-2023 09:52', '2023-09-13 14:30', '2023-09-13 16:00', '86', 'Selesai', '', '#0000FF'),
(1504, 102, 'NOVIRIYANTI ARIFIN', 'D3 KEPERAWATAN', 'Ruang Teater', 'OSCE KEPERAWATAN', '13-09-2023 09:53', '2023-09-14 08:00', '2023-09-14 16:00', '86', 'Selesai', '', '#0000FF'),
(1505, 102, 'NOVIRIYANTI ARIFIN', 'D3 KEPERAWATAN', 'Ruang Teater', 'OSCE KEPERAWATAN', '13-09-2023 09:54', '2023-09-15 08:00', '2023-09-15 16:00', '86', 'Selesai', '', '#0000FF'),
(1506, 101, 'Farhand', 'D4 Promosi Kesehatan', 'Laboratorium Komputer', 'UKOM PROMKES', '13-09-2023 10:06', '2023-09-18 07:00', '2023-09-18 12:00', '70', 'Selesai', '', '#0000FF'),
(1508, 102, 'UKM PADUS ', 'POLTEKKES KEMENKES BENGKULU ', 'Ruang Teater', 'LATIHAN PADUS WISUDA ', '13-09-2023 15:22', '2023-09-13 16:00', '2023-09-13 21:30', '60', 'Selesai', '', '#0000FF'),
(1509, 102, 'Wisuda Andeka', 'D4 Promosi Kesehatan', 'Ruang Teater', 'Pertemuan Kader Sekota Bengkulu', '14-09-2023 09:48', '2023-09-19 10:00', '2023-09-19 13:00', '50', 'Selesai', '', '#0000FF'),
(1510, 102, 'UKM PMK POLKESLU ', 'POLTEKKES KEMENKES BENGKULU ', 'Ruang Teater', 'IBADAH BULANAN UKM PMK', '14-09-2023 13:13', '2023-09-14 16:00', '2023-09-14 18:00', '40', 'Selesai', '', '#0000FF'),
(1511, 102, 'UKM PADUS ', 'POLTEKKES KEMENKES BENGKULU ', 'Ruang Teater', 'LATIHAN PADUS WISUDA ', '14-09-2023 13:15', '2023-09-14 18:15', '2023-09-14 21:30', '60', 'Selesai', '', '#0000FF'),
(1512, 102, 'QOMARIYAH RAHMADANI ', '3A D3 GIZI', 'Ruang Teater', 'Kuliah MK ETIKA PROFESI', '14-09-2023 14:43', '2023-09-18 08:00', '2023-09-18 10:00', '43', 'Selesai', '', '#0000FF'),
(1513, 102, 'QOMARIYAH RAHMADANI ', '3A D3 GIZI', 'Ruang Teater', 'Kuliah MK ETIKA PROFESI', '14-09-2023 14:43', '2023-09-18 08:00', '2023-09-18 10:00', '43', 'Selesai', '', '#0000FF'),
(1514, 102, 'UKM PADUS ', 'POLTEKKES KEMENKES BENGKULU ', 'Ruang Teater', 'LATIHAN PADUS WISUDA ', '15-09-2023 14:21', '2023-09-15 14:30', '2023-09-15 21:30', '60', 'Selesai', '', '#0000FF'),
(1515, 102, 'UKM PADUS ', 'POLTEKKES KEMENKES BENGKULU ', 'Ruang Teater', 'LATIHAN PADUS WISUDA ', '15-09-2023 14:21', '2023-09-15 14:30', '2023-09-15 21:30', '60', 'Selesai', '', '#0000FF'),
(1516, 102, 'Bunda Andeka', 'D4 Promosi Kesehatan', 'Ruang Teater', 'Pertemuan Kader', '16-09-2023 21:28', '2023-09-20 10:00', '2023-09-20 13:30', '50', 'Selesai', '', '#0000FF'),
(1517, 101, 'Atek Chartika', 'Str kep', 'Laboratorium Komputer', 'Uts tk.1 dsn tk.3', '17-09-2023 18:49', '2023-09-18 13:00', '2023-09-18 16:00', '88', 'Selesai', '', '#0000FF'),
(1518, 102, 'Erlicha Tamila Balma', 'Poltekkes Kemenkes Bengkulu', 'Ruang Teater', 'Kuliah PBL-SPMI', '18-09-2023 08:23', '2023-09-18 13:00', '2023-09-17 15:40', '43', 'Selesai', '', '#0000FF'),
(1519, 102, 'Erlicha Tamila Balma', 'D3 3A Gizi', 'Ruang Teater', 'Kuliah MK PBL-SPMI', '18-09-2023 08:27', '2023-09-17 13:00', '2023-09-17 15:40', '43', 'Selesai', '', '#0000FF'),
(1520, 101, 'Aisyah salsabillah', 'Poltekkes Kemenkes Bengkulu 3BTLM ', 'Laboratorium Komputer', 'Mata Kuliah TIK', '18-09-2023 13:32', '2023-09-19 09:00', '2023-09-18 12:00', '54', 'Selesai', '', '#0000FF'),
(1521, 102, 'Khalifah Tulhayati', 'Promosi Kesehatan ', 'Ruang Teater', 'Latihan Persembahan Yudisium ', '18-09-2023 15:07', '2023-09-18 15:07', '2023-09-18 16:08', '45', 'Selesai', '', '#0000FF'),
(1522, 102, 'UKM PADUS ', 'POLTEKKES KEMENKES BENGKULU ', 'Ruang Teater', 'LATIHAN UNTUK PADUS WISUDA', '18-09-2023 15:47', '2023-09-18 16:00', '2023-09-18 22:00', '60', 'Selesai', '', '#0000FF'),
(1523, 102, 'QOMARIYAH RAHMADANI ', '3A D3 GIZI', 'Ruang Teater', 'Kuliah MK ETIKA PROFESI', '19-09-2023 07:47', '2023-09-19 08:00', '2023-09-19 10:00', '43', 'Selesai', '', '#0000FF'),
(1524, 102, 'Wisuda Andeka', 'D4 Promosi Kesehatan', 'Ruang Teater', 'Pertemuan Kader', '19-09-2023 11:20', '2023-09-20 13:30', '2023-09-20 15:30', '50', 'Selesai', '', '#0000FF'),
(1525, 101, 'Noviriyanti Arifin', 'D3 Kep', 'Laboratorium Komputer', 'UTS tk. 1', '19-09-2023 12:12', '2023-09-20 08:00', '2023-09-20 10:30', '59', 'Selesai', '', '#0000FF'),
(1526, 101, 'Noviriyanti Arifin', 'D3 Keperawatan', 'Laboratorium Komputer', 'UTS Tk. 1', '19-09-2023 12:13', '2023-09-22 08:00', '2023-09-22 11:00', '96', 'Selesai', '', '#0000FF'),
(1527, 102, 'Nurulita dwi kurniasari', 'PolKeslu', 'Ruang Teater', 'Perkuliahan', '19-09-2023 13:20', '2023-09-20 13:21', '2023-09-20 13:22', '43', 'Selesai', '', '#0000FF'),
(1528, 102, 'UKM PADUS ', 'POLTEKKES KEMENKES BENGKULU ', 'Ruang Teater', 'Latihan untuk padus wisuda', '19-09-2023 13:48', '2023-09-19 16:00', '2023-09-19 22:00', '60', 'Selesai', '', '#0000FF'),
(1529, 102, 'Alfira Qiqin Salsabila ', 'DIII GIZI 3A', 'Ruang Teater', 'perkuliahan ', '19-09-2023 13:49', '2023-09-20 08:00', '2023-09-20 10:00', '43', 'Selesai', '', '#0000FF'),
(1530, 102, 'Lisma Ningsih, SKM., MKM', 'DIII Farmasi ', 'Ruang Teater', 'Perkuliahan ', '21-09-2023 07:47', '2023-09-21 07:48', '2023-09-21 12:30', '45', 'Selesai', '', '#0000FF'),
(1531, 101, 'Jaksen sadri,', 'Poltekkes', 'Laboratorium Komputer', 'Pbm', '21-09-2023 07:58', '2023-09-21 10:00', '2023-09-21 11:00', '40', 'Selesai', '', '#0000FF'),
(1532, 102, 'QOMARIYAH RAHMADANI', '3A D3 GIZI', 'Ruang Teater', 'KULIAH MK ETIKA PROFESI', '21-09-2023 16:19', '2023-09-25 08:00', '2023-09-25 10:00', '43', 'Selesai', '', '#0000FF'),
(1533, 102, 'HMJ ANALIS KESEHATAN ', 'HMJ ANALIS KESEHATAN ', 'Ruang Teater', 'QnA HMJ Analis ', '22-09-2023 20:45', '2023-09-29 12:00', '2023-09-29 18:00', '100', 'Batal', '', '#000'),
(1534, 102, 'QOMARIYAH RAHMADANI ', '3A D3 GIZI', 'Ruang Teater', 'KULIAH MK ETIKA PROFESI', '25-09-2023 08:09', '2023-09-25 14:00', '2023-09-25 15:40', '88', 'Selesai', '', '#0000FF'),
(1536, 102, 'Putri ayu Anggelyana ', 'Poltekkes Kemenkes bengkulu ', 'Ruang Teater', 'PBL-SPMI ', '25-09-2023 08:18', '2023-09-25 13:00', '2023-09-25 15:40', '88', 'Selesai', '', '#0000FF'),
(1537, 102, 'Putri ayu Anggelyana ', '3A Gizi', 'Ruang Teater', 'PBL-SPMI ', '25-09-2023 08:20', '2023-09-25 13:00', '2023-09-25 15:40', '88', 'Selesai', '', '#0000FF'),
(1538, 101, 'Alfira Qiqin Salsabila ', 'DIII GIZI', 'Laboratorium Komputer', 'perkuliahan ', '25-09-2023 13:05', '2023-09-26 13:00', '2023-09-26 16:00', '43', 'Selesai', '', '#0000FF'),
(1539, 102, 'Alfira Qiqin Salsabila ', 'DIII GIZI ', 'Ruang Teater', 'perkuliahan ', '25-09-2023 13:07', '2023-09-26 13:00', '2023-09-26 16:00', '43', 'Selesai', '', '#0000FF'),
(1540, 101, 'Jaksen Sadri', 'Polkeslu', 'Laboratorium Komputer', 'PBM TLM', '25-09-2023 15:37', '2023-09-26 10:05', '2023-09-26 11:30', '40', 'Selesai', '', '#0000FF'),
(1541, 102, 'Nurulita dwi kurniasari', 'DIII GIZI ', 'Ruang Teater', 'perkuliahan ', '25-09-2023 16:29', '2023-09-26 10:00', '2023-09-26 12:00', '43', 'Selesai', '', '#0000FF'),
(1542, 102, 'Nista', 'Tk III Prodi STr Gizi', 'Ruang Teater', 'KUliah PML ', '26-09-2023 08:13', '2023-09-27 08:00', '2023-09-27 12:00', '90', 'Selesai', '', '#0000FF'),
(1543, 102, 'HMJ ANALIS KESEHATAN', 'HMJ ANALIS KESEHATAN POLKESLU', 'Ruang Teater', 'Q & A HMJ ANALIS KESEHATAN', '26-09-2023 14:22', '2023-10-02 15:00', '2023-10-03 18:00', '100', 'Selesai', '', '#0000FF'),
(1544, 102, 'mekti karunia ', 'DIII GIZI', 'Ruang Teater', 'perkuliahan ', '26-09-2023 19:23', '2023-09-27 13:00', '2023-09-27 16:00', '90', 'Selesai', '', '#0000FF'),
(1545, 101, 'Noviriyanti Arifin', 'Prodi D3 Keperawatan', 'Laboratorium Komputer', 'Remedial UTS Tk.1', '28-09-2023 09:46', '2023-09-29 08:00', '2023-09-29 10:30', '59', 'Selesai', '', '#0000FF'),
(1546, 102, 'QOMARIYAH RAHMADANI ', 'TK. 3 D3 GIZI', 'Ruang Teater', 'KULIAH MK ETIKA PROFESI', '28-09-2023 10:47', '2023-09-29 13:30', '2023-09-29 16:00', '88', 'Selesai', '', '#0000FF'),
(1547, 102, 'Delvio Tellyan pagase (3B Farmasi)', 'Poltekkes Kemenkes Bengkulu ', 'Ruang Teater', 'Perkuliahan metodologi penelitian ', '29-09-2023 11:20', '2023-10-02 09:00', '2023-10-02 11:30', '43', 'Selesai', '', '#0000FF'),
(1548, 102, 'Delvio Tellyan pagase (3B Farmasi)', 'Poltekkes Kemenkes Bengkulu ', 'Ruang Teater', 'Perkuliahan metodologi penelitian ', '29-09-2023 11:20', '2023-10-02 09:00', '2023-10-02 11:30', '43', 'Selesai', '', '#0000FF'),
(1549, 102, 'QOMARIYAH RAHMADANI ', '3A D3 GIZI', 'Ruang Teater', 'KULIAH MK ETIKA PROFESI', '01-10-2023 15:49', '2023-10-02 08:00', '2023-10-02 10:00', '43', 'Selesai', '', '#0000FF'),
(1550, 102, 'QOMARIYAH RAHMADANI ', '3A D3 GIZI', 'Ruang Teater', 'Kuliah MK Etika Profesi', '01-10-2023 15:51', '2023-10-02 08:00', '2023-10-02 10:00', '43', 'Selesai', '', '#0000FF'),
(1551, 102, 'Lilian Febrianti ( 2B Promosi Kesehatan)', 'Poltekkes kemenkes bengkulu ', 'Ruang Teater', 'Pembelajaran advokasi kesehatan ', '02-10-2023 07:57', '2023-10-02 13:00', '2023-10-01 17:50', '46', 'Selesai', '', '#0000FF'),
(1552, 101, 'Alya Afrika Utami ', 'D3 Farmasi', 'Laboratorium Komputer', 'Belajar Mata Kuliah TIK', '02-10-2023 09:33', '2023-10-03 08:00', '2023-10-03 10:00', '53', 'Selesai', '', '#0000FF'),
(1553, 102, 'Delvio', 'Poltekkes Kemenkes Bengkulu ', 'Ruang Teater', 'Perkuliahan metodologi penelitian ', '02-10-2023 09:34', '2023-10-02 13:00', '2023-10-02 15:00', '88', 'Selesai', '', '#0000FF'),
(1554, 102, 'Dr. Halimah, S.Si.,MKM', 'Jurusan Analis Kesehatan DIII Farmasi ', 'Ruang Teater', 'Kuliah Metodologi Penelitian ', '02-10-2023 09:56', '2023-10-02 13:00', '2023-10-02 14:30', '86', 'Selesai', '', '#0000FF'),
(1555, 102, 'Delva viofa Cantika dan Zahra Arya asyfa', 'Poltekkes Kemenkes bengkulu ', 'Ruang Teater', ' perkuliahan pbak str 1a dan 1b', '03-10-2023 15:00', '2023-10-04 13:30', '2023-10-04 16:00', '100', 'Selesai', '', '#0000FF'),
(1556, 102, 'Ryco tampati', 'D3 gizi', 'Ruang Teater', 'Perkuliahan PGD', '04-10-2023 07:58', '2023-10-04 01:00', '2023-10-04 02:40', '88', 'Selesai', '', '#0000FF'),
(1557, 102, 'Putri Salsabilla', 'D3 Gizi ', 'Ruang Teater', 'Perkuliahan PPG (Bunda Yunita )', '04-10-2023 16:00', '2023-10-05 08:00', '2023-10-05 12:00', '88', 'Selesai', '', '#0000FF'),
(1558, 101, 'Bobby Ardiansyah ', 'Jurusan Keperawatan ', 'Laboratorium Komputer', 'Her Keperawatan Komunitas ', '04-10-2023 19:36', '2023-10-05 07:30', '2023-10-05 12:00', '88', 'Selesai', '', '#0000FF'),
(1559, 102, 'Helda triutami', 'Poltekkes kemenkes bengkulu', 'Ruang Teater', 'Perkuliahan kewirausahaan(Bunda Rani)', '05-10-2023 08:06', '2023-10-05 08:50', '2023-10-04 10:30', '45', 'Selesai', '', '#0000FF'),
(1560, 102, 'Helda triutami', 'D3 Gizi tingkat 3B', 'Ruang Teater', 'Perkuliahan Kewirausahaan(Bunda Rani)', '05-10-2023 08:08', '2023-10-05 08:50', '2023-10-05 10:30', '45', 'Selesai', '', '#0000FF'),
(1561, 102, 'mekti karunia', 'DIII GIZI ', 'Ruang Teater', 'perkuliahan ', '06-10-2023 08:38', '2023-10-06 13:30', '2023-10-06 16:00', '90', 'Selesai', '', '#0000FF'),
(1564, 102, 'Heni Dwi Sinta & Kharistiyanti', 'Poltekkes Kemenkes Bengkulu', 'Ruang Teater', 'Perkuliahan PBAK str gizi 1A dan 1B', '11-10-2023 08:30', '2023-10-11 13:00', '2023-10-11 15:30', '100', 'Selesai', '', '#0000FF'),
(1565, 102, 'Lisma Ningsih., SKM., MKM', 'Jurusan Analis Kesehatan ', 'Ruang Teater', 'Perkuliahan Biostatistik ', '11-10-2023 13:06', '2023-10-12 10:00', '2023-10-12 12:30', '44', 'Selesai', '', '#0000FF'),
(1566, 102, 'Fazla Alifya ', 'Jurusan Analis Kesehatan DIII Farmasi ', 'Ruang Teater', 'Perkuliahan Biostatistik ', '11-10-2023 13:10', '2023-10-12 10:00', '2023-10-12 12:30', '44', 'Selesai', '', '#0000FF'),
(1567, 101, 'Noviriyanti Arifin', 'Prodi D3 Keperawatan', 'Laboratorium Komputer', 'UAS Mahasiswa Tk.2', '12-10-2023 09:48', '2023-10-16 08:00', '2023-10-16 10:00', '53', 'Selesai', '', '#0000FF'),
(1568, 101, 'Noviriyanti Arifin', 'Prodi D3 Keperawatan', 'Laboratorium Komputer', 'UAS Mahasiswa Tk.2', '12-10-2023 09:49', '2023-10-17 10:00', '2023-10-17 12:00', '53', 'Selesai', '', '#0000FF'),
(1569, 101, 'Noviriyanti Arifin', 'Prodi D3 Keperawatan', 'Laboratorium Komputer', 'UAS Mahasiswa Tk.2', '12-10-2023 09:51', '2023-10-18 08:00', '2023-10-18 10:00', '53', 'Selesai', '', '#0000FF'),
(1570, 101, 'Noviriyanti Arifin', 'Prodi D3 Keperawatan', 'Laboratorium Komputer', 'UAS Mahasiswa Tk.2', '12-10-2023 09:51', '2023-10-19 08:00', '2023-10-19 10:00', '53', 'Selesai', '', '#0000FF'),
(1571, 101, 'Noviriyanti Arifin', 'Prodi D3 Keperawatan', 'Laboratorium Komputer', 'UAS Mahasiswa Tk.2', '12-10-2023 09:52', '2023-10-20 08:00', '2023-10-20 10:00', '53', 'Selesai', '', '#0000FF'),
(1572, 101, 'Anjesmara akmita', 'Str keperawatan dan profesi ners tk 3', 'Laboratorium Komputer', 'UTS ', '13-10-2023 11:19', '2023-10-13 15:20', '2023-10-13 16:00', '88', 'Selesai', '', '#0000FF'),
(1573, 101, 'DINA ANGGRAINI', 'DIV KEBIDANAN', 'Laboratorium Komputer', 'UAS Agama dan Anatomi', '13-10-2023 20:23', '2023-11-13 08:00', '2023-11-13 10:00', '92', 'Selesai', '', '#0000FF'),
(1577, 101, 'DINA ANGGRAINI', 'D-IV KEBIDANAN', 'Laboratorium Komputer', 'UAS IKK dan Profesionalisme', '13-10-2023 20:35', '2023-10-30 08:00', '2023-10-30 10:00', '97', 'Selesai', '', '#0000FF'),
(1578, 101, 'DINA ANGGRAINI', 'D-IV KEBIDANAN', 'Laboratorium Komputer', 'UAS Psikologi dan komunikasi', '13-10-2023 20:36', '2023-10-31 08:00', '2023-10-31 10:00', '97', 'Selesai', '', '#0000FF'),
(1579, 101, 'DINA ANGGRAINI', 'D-IV KEBIDANAN', 'Laboratorium Komputer', 'UAS KDPK 1 DAN PBAK', '13-10-2023 20:38', '2023-11-01 08:00', '2023-11-01 10:00', '97', 'Selesai', '', '#0000FF'),
(1580, 101, 'DINA ANGGRAINI', 'D-IV KEBIDANAN', 'Laboratorium Komputer', 'UAS Dokumentasi Kebidanan', '13-10-2023 20:40', '2023-11-02 08:00', '2023-11-02 09:00', '97', 'Selesai', '', '#0000FF'),
(1592, 101, 'DINA ANGGRAINI', 'D-IV KEBIDANAN', 'Laboratorium Komputer', 'UAS Fisika, IKK dan mikrobiologi', '14-10-2023 20:28', '2023-11-06 08:00', '2023-11-06 11:00', '44', 'Selesai', '', '#0000FF'),
(1593, 101, 'DINA ANGGRAINI', 'D-IV KEBIDANAN', 'Laboratorium Komputer', 'UAS Fisika, IKK dan mikrobiologi', '14-10-2023 20:28', '2023-11-06 08:00', '2023-11-06 11:00', '44', 'Selesai', '', '#0000FF'),
(1594, 101, 'DINA ANGGRAINI', 'D-IV KEBIDANAN', 'Laboratorium Komputer', 'UAS Askeb Pranikah dan Critical analysis', '14-10-2023 20:37', '2023-11-07 08:00', '2023-11-07 10:00', '44', 'Selesai', '', '#0000FF'),
(1595, 101, 'DINA ANGGRAINI', 'D-IV KEBIDANAN', 'Laboratorium Komputer', 'UAS Manajemen kepemimpinan, Askeb anak rentan, Pelayanan Kebidanan dalam pelayanan kesehatan', '14-10-2023 20:40', '2023-11-08 08:00', '2023-11-08 11:00', '44', 'Selesai', '', '#0000FF'),
(1598, 102, 'Vina amanda & Rahayu kusuma', 'D3 Gizi ', 'Ruang Teater', 'Perkuliahan PBAK kelas 2A & 2B', '15-10-2023 18:13', '2023-10-16 13:00', '2023-10-16 16:00', '96', 'Selesai', '', '#0000FF'),
(1600, 101, 'Shalli shavira', 'DIV Keperawatan', 'Laboratorium Komputer', 'UTS KEP KRITIS DAN MANAJEMEN BENCANA', '16-10-2023 07:59', '2023-10-16 13:00', '2023-10-16 15:00', '49', 'Selesai', '', '#0000FF'),
(1601, 101, 'Alya Afrika Utami ', 'D3 Farmasi ', 'Laboratorium Komputer', 'Perkuliahan ', '16-10-2023 11:20', '2023-10-17 08:00', '2023-10-17 10:50', '53', 'Selesai', '', '#0000FF'),
(1602, 101, 'Farhand', 'D4 Promosi Kesehatan', 'Laboratorium Komputer', 'UTS Promkes', '16-10-2023 11:27', '2023-10-17 13:00', '2023-10-20 16:00', '78', 'Selesai', '', '#0000FF'),
(1603, 102, 'Jenia Fetrisia', 'D3 Gizi', 'Ruang Teater', 'Mk Hukum Kesehatan', '16-10-2023 12:37', '2023-10-16 14:00', '2023-10-16 15:40', '43', 'Selesai', '', '#0000FF'),
(1604, 102, 'Muhammad Abdul Faris ', 'Poltekkes Kemenkes Bengkulu', 'Ruang Teater', 'Pembelajaran Mata Kuliah KDK (Video/ShortFilm)', '17-10-2023 08:26', '2023-10-17 08:30', '2023-10-17 12:00', '58', 'Selesai', '', '#0000FF'),
(1606, 102, 'UKM GSM ', 'Poltekkes kemenkes Bengkulu', 'Ruang Teater', 'Latihan Rutin ', '17-10-2023 08:41', '2023-10-17 16:00', '2023-10-17 18:00', '40', 'Batal', 'Ruang Teater digunakan untuk Pembelajaran', '#000'),
(1607, 102, 'Noviriyanti Arifin', 'Prodi D3 Keperawatan', 'Ruang Teater', 'Kuliah Pakar', '17-10-2023 13:53', '2023-10-18 08:00', '2023-10-18 11:00', '95', 'Selesai', '', '#0000FF'),
(1608, 101, 'Farhand', 'D4 Promkes', 'Laboratorium Komputer', 'UTS Promkes', '17-10-2023 14:18', '2023-10-18 13:00', '2023-10-18 16:00', '78', 'Selesai', '', '#0000FF'),
(1609, 101, 'Farhand', 'D4 Promkes', 'Laboratorium Komputer', 'UTS Promkes', '17-10-2023 14:19', '2023-10-19 13:00', '2023-10-19 16:00', '78', 'Selesai', '', '#0000FF'),
(1610, 101, 'Farhand', 'D4 Promkes', 'Laboratorium Komputer', 'UTS Promkes', '17-10-2023 14:19', '2023-10-20 13:00', '2023-10-20 16:00', '78', 'Selesai', '', '#0000FF'),
(1611, 101, 'Mutiara Zulkarnain ', 'Poltekkes Kemenkes Bengkulu ', 'Laboratorium Komputer', 'PBM ', '18-10-2023 07:45', '2023-10-18 08:00', '2023-10-18 10:50', '46', 'Selesai', '', '#0000FF'),
(1612, 102, 'Dwinda inong jelita riska', 'Jurusan keperawatan', 'Ruang Teater', 'Seminar kasus PPN KMB', '18-10-2023 08:16', '2023-10-18 10:00', '2023-10-18 14:00', '40', 'Selesai', '', '#0000FF'),
(1613, 102, 'Rifqi Roofif Wahyudi', 'Promosi kesehatan', 'Ruang Teater', 'Pembelajaran mata kuliah Administrasi kebijakan kesehatan 4A dan 4B', '18-10-2023 09:21', '2023-10-19 10:00', '2023-10-19 11:55', '70', 'Selesai', '', '#0000FF'),
(1615, 102, 'Nini Martina', 'Jurusan Promosi Kesehatan', 'Ruang Teater', 'Pembelajaran', '18-10-2023 09:35', '2023-10-19 13:00', '2023-10-19 17:00', '82', 'Selesai', '', '#0000FF'),
(1616, 101, 'Abillah Almubaroqah', 'Poltekkes Kemenkes Bengkulu', 'Laboratorium Komputer', 'Tutorial editing', '18-10-2023 14:34', '2023-10-19 13:00', '2023-10-19 15:50', '35', 'Selesai', '', '#0000FF'),
(1617, 101, 'Farhand', 'D4 Promkes', 'Laboratorium Komputer', 'UTS Promkes', '19-10-2023 07:58', '2023-10-20 13:00', '2023-10-20 16:00', '78', 'Selesai', '', '#0000FF'),
(1618, 102, 'Junaidi Imanuel', 'Poltekkes Kemenkes Bengkulu', 'Ruang Teater', 'Kuliah PGM', '19-10-2023 08:05', '2023-10-19 08:00', '2023-10-19 10:00', '45', 'Selesai', '', '#0000FF'),
(1619, 102, 'Fazla Alifya ', 'Jurusan Analis Kesehatan DIII Farmasi ', 'Ruang Teater', 'Pembelajaran Biostatistik ', '19-10-2023 13:38', '2023-10-20 09:30', '2023-10-20 12:00', '87', 'Selesai', '', '#0000FF'),
(1620, 101, 'Noviriyanti Arifin', 'Prodi D3 Keperawatan', 'Laboratorium Komputer', 'UAS Mahasiswa Tk.2', '20-10-2023 17:23', '2023-10-23 08:00', '2023-10-23 10:00', '53', 'Selesai', '', '#0000FF'),
(1621, 101, 'Noviriyanti Arifin', 'Prodi D3 Keperawatan', 'Laboratorium Komputer', 'UAS Mahasiswa Tk.2', '20-10-2023 17:25', '2023-10-24 08:00', '2023-10-24 10:00', '53', 'Selesai', '', '#0000FF'),
(1623, 102, 'Atek Chartika', 'Keperawatan', 'Ruang Teater', 'kuliah', '23-10-2023 08:26', '2023-10-23 08:30', '2023-10-23 11:00', '80', 'Selesai', '', '#0000FF'),
(1624, 102, 'Yerlis Marliani', 'D3 Gizi ', 'Ruang Teater', 'Hukum kesehatan', '23-10-2023 09:02', '2023-10-23 10:02', '2023-10-23 12:03', '88', 'Selesai', '', '#0000FF'),
(1625, 101, 'Miza safani', 'Analis kesehatan ', 'Laboratorium Komputer', 'Mata kuliah teknologi sistem informasi ', '23-10-2023 09:12', '2023-10-24 13:01', '2023-10-24 15:00', '54', 'Selesai', '', '#0000FF'),
(1626, 101, 'Anggi Nur Alsafitri', 'Poltekkes Kemenkes Bengkulu', 'Laboratorium Komputer', 'Perkuliahan', '23-10-2023 11:17', '2023-10-24 08:00', '2023-10-24 10:00', '51', 'Selesai', '', '#0000FF'),
(1627, 101, 'Meysi Wina Putri Aulia', 'Poltekkes Kemenkes Bengkulu', 'Laboratorium Komputer', 'PBM', '23-10-2023 12:04', '2023-10-25 13:00', '2023-10-25 16:00', '44', 'Selesai', '', '#0000FF'),
(1629, 102, 'Gibrina ', 'DIII Gizi', 'Ruang Teater', 'Kewirausahaan ', '23-10-2023 18:58', '2023-10-24 08:00', '2023-10-24 10:00', '88', 'Selesai', '', '#0000FF'),
(1630, 102, 'Helda Triutami', 'D3 Gizi Tingkat 3 AB', 'Ruang Teater', 'Mk Kewirausahaan Bunda Rani', '23-10-2023 19:24', '2023-10-24 10:40', '2023-10-24 11:40', '88', 'Selesai', '', '#0000FF'),
(1631, 102, 'UKM GSM', 'Poltekkes Kemenkes Bengkulu', 'Ruang Teater', 'Latihan paduan suara penampilan 15 November AcaraHKN', '23-10-2023 23:21', '2023-10-24 15:30', '2023-10-24 18:00', '40', 'Selesai', '', '#0000FF'),
(1632, 101, 'Farhand', 'D4 Promkes ', 'Laboratorium Komputer', 'UAS Promkes', '24-10-2023 08:14', '2023-10-30 13:00', '2023-10-30 16:00', '85', 'Selesai', '', '#0000FF'),
(1633, 101, 'Farhand', 'D4 Promkes', 'Laboratorium Komputer', 'UAS Promkes', '24-10-2023 08:16', '2023-10-31 13:00', '2023-10-31 16:00', '85', 'Selesai', '', '#0000FF'),
(1634, 101, 'Farhand', 'D4 Promkes', 'Laboratorium Komputer', 'UAS Promkes', '24-10-2023 08:17', '2023-11-01 13:00', '2023-11-01 16:00', '85', 'Selesai', '', '#0000FF'),
(1635, 101, 'Noviriyanti Arifin', 'D3 Keperawatan', 'Laboratorium Komputer', 'UAS Tingkat 2', '24-10-2023 08:33', '2023-10-26 08:00', '2023-10-26 10:00', '53', 'Selesai', '', '#0000FF'),
(1636, 101, 'Noviriyanti Arifin', 'D3 Keperawatan', 'Laboratorium Komputer', 'UAS Tingkat 2', '24-10-2023 08:34', '2023-10-27 08:00', '2023-10-27 10:00', '53', 'Selesai', '', '#0000FF'),
(1637, 101, 'Farhand', 'D4 Promkes', 'Laboratorium Komputer', 'UAS Promkes', '24-10-2023 08:41', '2023-11-02 13:00', '2023-11-02 16:00', '85', 'Selesai', '', '#0000FF'),
(1638, 101, 'Miza safani', 'Analis kesehatan ', 'Laboratorium Komputer', 'Mata kuliah teknologi sistem informasi ', '24-10-2023 15:01', '2023-10-25 10:00', '2023-10-25 12:00', '54', 'Selesai', '', '#0000FF'),
(1639, 101, 'Farhand', 'D4 Promkes', 'Laboratorium Komputer', 'UAS Promkes', '24-10-2023 16:04', '2023-11-03 13:00', '2023-11-03 16:00', '85', 'Selesai', '', '#0000FF'),
(1640, 102, 'UKM GSM', 'Poltekkes kemenkes Bengkulu', 'Ruang Teater', 'Latihan padus penampilan 15 Nov HKN', '25-10-2023 08:09', '2023-10-25 15:30', '2023-10-25 18:30', '40', 'Selesai', '', '#0000FF'),
(1641, 101, 'Suci Sartika', 'Unit Pengembangan Bahasa', 'Laboratorium Komputer', 'TOEFL', '25-10-2023 08:51', '2023-11-07 08:00', '2023-11-07 16:00', '100', 'Selesai', '', '#0000FF'),
(1642, 102, 'Fazla Alifya ', 'Jurusan Analis Kesehatan DIII Farmasi ', 'Ruang Teater', 'Perkuliahan Biostatistik ', '25-10-2023 13:50', '2023-10-26 13:00', '2023-10-26 15:30', '88', 'Selesai', '', '#0000FF'),
(1643, 101, 'Indo putra Ali Dayanto', 'Keperawatan ', 'Laboratorium Komputer', 'Her uts', '26-10-2023 10:55', '2023-10-26 15:30', '2023-10-26 17:00', '25', 'Selesai', '', '#0000FF'),
(1644, 102, 'Indo putra Ali Dayanto ', 'Keperawatan ', 'Ruang Teater', 'Penyuluhan mata kuliah promosi kesehatan ', '26-10-2023 11:30', '2023-10-27 15:30', '2023-10-27 17:00', '20', 'Selesai', '', '#0000FF'),
(1645, 101, 'PUJI PANGESTU', 'D4 PROMOSI KESEHATAN ', 'Laboratorium Komputer', 'KULIAH MATA KUANTITATIF ', '26-10-2023 11:31', '2023-10-30 08:30', '2023-10-30 11:30', '35', 'Batal', '', '#000'),
(1646, 102, 'Indo Putra Ali Dayanto ', 'Keperawatan ', 'Ruang Teater', 'Penyuluhan mata kuliah promosi kesehatan ', '26-10-2023 11:48', '2023-10-27 14:00', '2023-10-27 15:00', '35', 'Selesai', '', '#0000FF'),
(1647, 102, 'HMJ KM PROMKES ', 'POLTEKKES KEMENKES BENGKULU ', 'Ruang Teater', 'OPEN RECRUITMENT', '26-10-2023 13:59', '2023-10-29 06:00', '2023-10-29 10:00', '70', 'Selesai', '', '#0000FF'),
(1648, 102, 'Farhand', 'D4 Promkes', 'Ruang Teater', 'Perkulihan Promkes', '26-10-2023 14:11', '2023-10-27 09:00', '2023-10-27 12:00', '80', 'Selesai', '', '#0000FF'),
(1649, 102, 'Farhand', 'D4 Promkes', 'Ruang Teater', 'Perkulihan PBAK', '26-10-2023 18:33', '2023-10-27 13:00', '2023-10-27 16:00', '80', 'Selesai', '', '#0000FF'),
(1650, 101, 'Adi guna', 'Keperawatan tk 2', 'Laboratorium Komputer', 'Her uts', '27-10-2023 08:39', '2023-10-27 10:00', '2023-10-27 12:00', '62', 'Selesai', '', '#0000FF'),
(1651, 101, 'DINA ANGGRAINI', 'D-III KEBIDANAN', 'Laboratorium Komputer', 'UAS', '27-10-2023 16:09', '2023-10-30 10:00', '2023-10-30 12:00', '100', 'Selesai', '', '#0000FF'),
(1652, 102, 'Indo Putra Ali Dayanto ', 'Keperawatan ', 'Ruang Teater', 'UAS STR TK 2', '29-10-2023 18:05', '2023-10-30 09:00', '2023-10-30 12:00', '100', 'Selesai', '', '#0000FF'),
(1653, 102, 'Bobby Ardiansyah ', 'Str Keperawatan ', 'Ruang Teater', 'UAS keperawatan paliatif ', '29-10-2023 19:58', '2023-10-30 08:00', '2023-10-30 12:00', '88', 'Batal', '', '#000'),
(1654, 102, 'MUHAMMAD AFIF YUDISTIRA', 'Keperawatan', 'Ruang Teater', 'Kuliah metlit', '30-10-2023 10:03', '2023-10-30 13:00', '2023-10-30 17:00', '95', 'Selesai', '', '#0000FF'),
(1655, 101, 'Anggi Nur Alsafitri', 'Poltekkes Kemenkes Bengkulu', 'Laboratorium Komputer', 'Perkuliahan', '30-10-2023 11:29', '2023-10-31 08:00', '2023-10-31 10:00', '51', 'Selesai', '', '#0000FF'),
(1656, 102, 'kartini dwi setiorini', 'poltekkes kemenkes bengkulu', 'Ruang Teater', 'ujian praktek PSG', '30-10-2023 16:15', '2023-10-31 07:00', '2023-10-31 18:00', '48', 'Selesai', '', '#0000FF'),
